paper_id,title,journal_short,publication_year,institution_names,primary_topic,cited_by_count,citation_percentile,total_valid_chars,exact_math_chars,exact_math_density,broad_math_chars,broad_math_density
JASA_2025_1258,Principal Component Analysis for Max-Stable Distributions,JASA,2025,Otto-von-Guericke University Magdeburg,Random Matrices and Applications,0,35.659705,188269,66592,0.3537,56425,0.2997
JASA_2025_1260,Factor Augmented Matrix Regression,JASA,2025,New York University | Princeton University,Psychometric Methodologies and Testing,0,44.751136,192752,87651,0.4547,90163,0.4678
JASA_2025_1262,The Impact of Job Stability on Monetary Poverty in Italy: Causal Small Area Estimation,JASA,2025,"Humboldt-Universität zu Berlin | University of California, Berkeley | University of Lausanne | University of Pisa | University of Toronto",Italy: Economic History and Contemporary Issues,0,45.254048,137577,8322,0.0605,29506,0.2145
JASA_2025_1263,Low-Rank Online Dynamic Assortment with Dual Contextual Information,JASA,2025,John D. and Catherine T. MacArthur Foundation | Purdue University West Lafayette | University of Michigan | University of North Carolina at Chapel Hill,Optimization and Search Problems,0,42.701592,134583,8426,0.0626,41027,0.3048
JASA_2025_1264,Multivariate Analysis for Multiple Network Data via Semi-Symmetric Tensor PCA,JASA,2025,"Baruch College | University of California, Los Angeles",Tensor decomposition and applications,0,36.833046,150140,35662,0.2375,36466,0.2429
JASA_2025_1267,Bayesian Signal Matching for Transfer Learning in ERP-Based Brain Computer Interface,JASA,2025,Emory University | University of Michigan–Ann Arbor,EEG and Brain-Computer Interfaces,0,64.022209,142615,0,0.0,23188,0.1626
JASA_2025_1268,Causality-Oriented Robustness: Exploiting General Noise Interventions,JASA,2025,ETH Zurich | University of Washington,Bayesian Modeling and Causal Inference,0,81.76549,298922,63038,0.2109,90821,0.3038
JASA_2026_1270,Possibilistic Inferential Models: A Review,JASA,2026,North Carolina State University,Bayesian Modeling and Causal Inference,0,3.05249,217924,1882,0.0086,57081,0.2619
JASA_2026_1274,A Latent Variable Approach to Learning High-Dimensional Multivariate Longitudinal Data,JASA,2026,Chinese University of Hong Kong | London School of Economics and Political Science,Bayesian Methods and Mixture Models,0,4.444691,286276,9098,0.0318,118937,0.4155
JASA_2026_1275,Scalable Estimation of Multinomial Response Models with Random Consideration Sets,JASA,2026,University of Alberta | Washington University in St. Louis,Survey Sampling and Estimation Techniques,0,4.768056,181346,18969,0.1046,44590,0.2459
JASA_2026_1276,Trans-Glasso: A Transfer Learning Approach to Precision Matrix Estimation,JASA,2026,Mohamed bin Zayed University of Artificial Intelligence | University of Chicago | University of Southern California,Face and Expression Recognition,0,4.248806,194808,42594,0.2186,97584,0.5009
JASA_2026_1279,Efficient Analysis of Latent Spaces in Heterogeneous Networks,JASA,2026,Florida State University | Hong Kong University of Science and Technology | University of Wisconsin–Madison,Natural Language Processing Techniques,0,7.013033,785193,128686,0.1639,640967,0.8163
JASA_2026_1281,Conditional Partial Exchangeability: A Probabilistic Framework for Multi-View Clustering,JASA,2026,Bocconi University | Foundation for Human Potential | National University of Singapore,Bayesian Methods and Mixture Models,0,7.046058,94625,16977,0.1794,20845,0.2203
JASA_2026_1282,Differentially Private Permutation Tests,JASA,2026,Korea Advanced Institute of Science and Technology | University of Cambridge,Cryptography and Data Security,0,7.055493,379889,65276,0.1718,157984,0.4159
JASA_2026_1283,Differentially Private Sliced Inverse Regression in the Federated Paradigm,JASA,2026,South China University of Technology | Southern University of Science and Technology,Random Matrices and Applications,0,6.741045,131209,33204,0.2531,37051,0.2824
JASA_2026_1284,Optimal Plug-in Gaussian Processes for Modeling Derivatives,JASA,2026,Rice University,Gaussian Processes and Bayesian Inference,0,7.862389999999999,126627,56641,0.4473,44636,0.3525
JASA_2026_1288,Optimal Differentially Private Ranking from Pairwise Comparisons*,JASA,2026,,Game Theory and Voting Systems,0,4.87159,177375,19194,0.1082,78441,0.4422
JASA_2026_1289,Subtype-Aware Registration of Longitudinal Electronic Health Records,JASA,2026,Duke University | Vanderbilt University,Machine Learning in Healthcare,0,8.135873,101141,0,0.0,13541,0.1339
JASA_2026_1290,Bayesian Image Mediation Analysis,JASA,2026,University of Chicago | University of Michigan,Bayesian Methods and Mixture Models,0,8.187769,206799,60811,0.2941,164625,0.7961
JASA_2026_1291,Searching for Local Associations while Controlling the False Discovery Rate,JASA,2026,California Southern University | Cheung Kong Graduate School of Business | Stanford University,Biomedical Text Mining and Ontologies,0,13.798816,193437,19560,0.1011,36647,0.1895
JASA_2026_1293,Heterogeneous Gene Network Estimation for Single-Cell Transcriptomic Data via a Joint Regularized Deep Neural Network,JASA,2026,Shanghai University of Finance and Economics,Single-cell and spatial transcriptomics,0,14.595326,54818,0,0.0,4301,0.0785
JASA_2026_1294,Translating predictive distributions into informative priors,JASA,2026,MRC Biostatistics Unit | University of Cambridge,AI-based Problem Solving and Planning,0,39.239905,146841,0,0.0,28372,0.1932
JASA_2026_1296,Totally Concave Regression,JASA,2026,,Advanced Statistical Methods and Models,0,23.045384,346715,225239,0.6496,195888,0.565
JASA_2026_1297,Online Statistical Inference for Contextual Bandits via Stochastic Gradient Descent,JASA,2026,New York University | Purdue University West Lafayette | The University of Texas at Austin | Xi'an Jiaotong University,Advanced Bandit Algorithms Research,0,17.667193,208306,74476,0.3575,79075,0.3796
JASA_2026_1300,Towards Better Statistical Understanding of Watermarking LLMs,JASA,2026,Imperial College London | The University of Sydney | Virginia Tech,Advanced Steganography and Watermarking Techniques,0,47.869654,196691,28759,0.1462,34188,0.1738
JASA_2026_1301,Enhanced inference for distributions and quantiles of individual treatment effects in various experiments,JASA,2026,AIDS Clinical Trials Group | University of Chicago,Statistical Methods in Clinical Trials,0,48.424311,255397,71500,0.28,74306,0.2909
JASA_2026_1304,On the Identifying Power of Generalized Monotonicity for Average Treatment Effects*,JASA,2026,University of Chicago | University of Southern California | Yale University,Advanced Causal Inference Techniques,0,85.459295,128823,4512,0.035,39493,0.3066
JASA_2026_1309,A Statistician’s Overview of Physics-Informed Neural Networks for Spatio-Temporal Data,JASA,2026,Lawrence Berkeley National Laboratory | Los Alamos National Laboratory | The University of Texas at Austin | University of Missouri,Gaussian Processes and Bayesian Inference,0,30.54078,107009,0,0.0,14942,0.1396
JASA_2026_1310,Factorial Difference-in-Differences*,JASA,2026,,Advanced Topics in Algebra,0,99.672668,129747,13589,0.1047,12133,0.0935
JASA_2026_1311,Perturbation Analysis of Randomized SVD and its Applications to Statistics,JASA,2026,Duke University | North Carolina State University,Statistical Mechanics and Entropy,0,45.499828,487009,73785,0.1515,437263,0.8979
JASA_2026_1312,"Out-of-Distribution Generalization under Random, Dense Distributional Shifts",JASA,2026,Stanford University,Probability and Risk Models,0,28.519656,107840,21126,0.1959,42660,0.3956
JASA_2026_1315,When Less Is More: Binary Feedback Can Outperform Ordinal Comparisons in Ranking Recovery,JASA,2026,Chinese University of Hong Kong | University of Shanghai for Science and Technology | Xiamen University,Game Theory and Voting Systems,0,32.150323,173806,11998,0.069,100564,0.5786
JASA_2026_1316,Spatial Scale-Aware Tail Dependence Modeling for High-Dimensional Spatial Extremes,JASA,2026,Colorado State University | Lawrence Berkeley National Laboratory | University of Missouri,Meteorological Phenomena and Simulations,0,29.621879,185879,31159,0.1676,35618,0.1916
JASA_2026_1318,Nonparametric Prior Learning in Differential Equation Modeling,JASA,2026,Huzhou University | Huzhou Vocational and Technical College | Statistical Research (United States) | Xi'an Jiaotong University,Psychometric Methodologies and Testing,0,30.140257,309139,107199,0.3468,219198,0.7091
JASA_2026_1319,Scalable and robust regression models for continuous proportional data,JASA,2026,Duke University | University of Jyväskylä,Advanced Statistical Methods and Models,0,37.780388,193568,16265,0.084,47764,0.2468
JASA_2026_1320,Functional-SVD for Heterogeneous Trajectories: Case Studies in Health*,JASA,2026,Duke University,Traffic control and management,0,93.122352,222959,85413,0.3831,96322,0.432
JASA_2026_1321,Residual Importance Weighted Transfer Learning for High-dimensional Linear Regression,JASA,2026,Beijing Normal University | Hong Kong Polytechnic University,Domain Adaptation and Few-Shot Learning,0,45.370054,186410,7903,0.0424,97775,0.5245
JASA_2026_1322,A Physics-Informed Spatiotemporal Deep Learning Framework for Turbulent Systems,JASA,2026,University of Notre Dame,Model Reduction and Neural Networks,0,46.735953,165213,0,0.0,44206,0.2676
JASA_2026_1323,Testing Independence and Conditional Independence in High Dimensions via Coordinatewise Gaussianization,JASA,2026,,Random Matrices and Applications,0,48.443922,781531,18558,0.0237,586891,0.751
JASA_2026_1324,High-dimensional Statistical Inference and Variable Selection Using Sufficient Dimension Association,JASA,2026,,Face and Expression Recognition,0,97.776896,124255,2663,0.0214,12909,0.1039
JASA_2026_1325,Scalable Bayesian Image-on-Scalar Regression for Population-Scale Neuroimaging Data Analysis,JASA,2026,Open Data Institute | University of Chicago | University of Michigan | University of Oxford,Functional Brain Connectivity Studies,0,44.260227,123760,0,0.0,30397,0.2456
JASA_2026_1327,Covariate-Adjusted Response-Adaptive Design with Delayed Outcomes,JASA,2026,,Statistical Methods in Clinical Trials,0,97.691064,156530,3666,0.0234,103962,0.6642
JASA_2026_1328,Tests for principal eigenvalues and eigenvectors,JASA,2026,Hong Kong University of Science and Technology | Princeton University | Shanghai University of Finance and Economics | University of Hong Kong,Statistical Distribution Estimation and Applications,0,92.176591,128666,65416,0.5084,61564,0.4785
JASA_2026_1330,Theory for Identification and Inference with Synthetic Controls: A Proximal Causal Inference Framework,JASA,2026,Carnegie Mellon University | King University | Peking University | St. Jude Children's Research Hospital | University of Michigan | University of Pennsylvania | Wharton County Junior College | William P. Wharton Trust,Advanced Causal Inference Techniques,0,49.251596,76915,1793,0.0233,61863,0.8043
JASA_2026_1332,Facilitating heterogeneous effect estimation via statistically efficient categorical modifiers,JASA,2026,Cornell University,Face and Expression Recognition,0,48.995959,206332,23880,0.1157,102838,0.4984
JASA_2026_1333,Stationarity of Manifold Time Series,JASA,2026,National University of Singapore | University of Toronto,Time Series Analysis and Forecasting,0,48.080065,126226,3995,0.0316,70324,0.5571
JASA_2026_1335,Staleness Factors and Volatility Estimation at High Frequencies,JASA,2026,University of Science and Technology of China,Financial Risk and Volatility Modeling,0,93.601583,98138,10937,0.1114,26337,0.2684
JASA_2026_1336,A Burden Shared is a Burden Halved: A Fairness-Adjusted Approach to Classification,JASA,2026,Communication University of Zhejiang | Emory University | The University of Sydney | University of Hong Kong,Ethics and Social Impacts of AI,0,92.072783,785110,6823,0.0087,39436,0.0502
JASA_2026_1338,Doubly robust pointwise confidence intervals for a monotonic continuous treatment effect curve,JASA,2026,University of Minnesota,Statistical Methods in Clinical Trials,0,57.25190799999999,177449,82483,0.4648,39197,0.2209
JASA_2026_1341,Nonparametric Causal Inference for Optogenetics: Sequential Excursion Effects for Dynamic Regimes,JASA,2026,National Institute of Mental Health | University of Pennsylvania,Quantum Mechanics and Applications,0,61.856702,267276,14265,0.0534,42976,0.1608
JASA_2026_1342,Hyperbolic Network Latent Space Model with Learnable Curvature,JASA,2026,,Graph Theory and Algorithms,0,97.827402,153073,23755,0.1552,33069,0.216
JASA_2026_1343,Inside-out cross-covariance for spatial multivariate data,JASA,2026,,Spatial and Panel Data Analysis,0,98.856306,189919,32946,0.1735,82385,0.4338
JASA_2026_1344,Inference for Deep Neural Network Estimators in Generalized Nonparametric Models,JASA,2026,University of Michigan,Generative Adversarial Networks and Image Synthesis,0,54.674299000000005,219987,7261,0.033,54690,0.2486
JASA_2026_1346,Mini-batch Estimation for Deep Cox Models: Statistical Foundations and Practical Guidance,JASA,2026,Carnegie Mellon University | University of Pittsburgh,Statistical Methods and Bayesian Inference,0,94.971161,259800,122445,0.4713,123564,0.4756
JASA_2026_1350,Adapting to Noise Tails in Private Linear Regression,JASA,2026,Academy of Mathematics and Systems Science | Chinese Academy of Sciences | College of Business Administration | Hong Kong University of Science and Technology | Illinois College | Peking University | Southwestern University of Finance and Economics | University of Illinois Chicago,Statistical Methods and Inference,0,61.655901,326771,25503,0.078,159867,0.4892
JASA_2026_1351,Limiting laws and consistent estimation criteria for fixed and diverging number of spiked eigenvalues,JASA,2026,Beijing Technology and Business University | Central China Normal University | Emory University | University of Michigan,Random Matrices and Applications,0,96.352362,222782,14597,0.0655,114097,0.5121
JASA_2026_1352,Individualized Dynamic Mediation Analysis Using Latent Factor Models,JASA,2026,Fudan University | Pennsylvania State University | The University of Texas at San Antonio | University of Pennsylvania,Psychometric Methodologies and Testing,0,59.814376,79987,2630,0.0329,19028,0.2379
JASA_2026_1353,Covariance test for discretely observed functional data: when and how it works?,JASA,2026,Beijing Normal University | Hong Kong Polytechnic University | Institute of Mathematical Statistics,Statistical Methods and Inference,0,61.691133,90773,4855,0.0535,14521,0.16
JASA_2026_1355,Cluster Quilting: Spectral Clustering for Patchwork Learning,JASA,2026,Baylor College of Medicine | Columbia University | University of Illinois Urbana-Champaign,Advanced Clustering Algorithms Research,0,73.52126,137617,15652,0.1137,34336,0.2495
JASA_2026_1356,Fairness-aware Contextual Dynamic Pricing with Strategic Buyers,JASA,2026,Yale University,Auction Theory and Applications,0,94.615835,205358,27135,0.1321,81868,0.3987
JASA_2026_1366,Efficient Nonparametric Inference for Mediation Analysis with Nonignorable Missing Confounders,JASA,2026,Chinese University of Hong Kong | Renmin University of China,Statistical Methods and Inference,0,95.547134,80540,4287,0.0532,14339,0.178
JASA_2026_1369,An Online Meta-Level Adaptive Design Framework with Targeted Learning Inference: Applications to Evaluating and Utilizing Surrogate Outcomes in Adaptive Designs,JASA,2026,Cape Town HVTN Immunology Laboratory / Hutchinson Centre Research Institute of South Africa | Fred Hutch Cancer Center | University of Washington,Advanced Multi-Objective Optimization Algorithms,0,94.801744,185303,52889,0.2854,29896,0.1613
JASA_2026_1372,Conformal prediction after data-dependent model selection,JASA,2026,University of Chicago,Statistical Methods and Inference,0,94.151062,180099,21645,0.1202,61002,0.3387
JASA_2026_1374,Tree Bandits for Generative Bayes,JASA,2026,University of Chicago,Advanced Bandit Algorithms Research,0,94.626589,172461,21966,0.1274,104254,0.6045
JASA_2026_1376,Semiparametric Efficient Fusion of Individual Data and Summary Statistics,JASA,2026,Harvard University | King University | Peking University | Renmin University of China,Statistical Methods and Inference,0,95.003156,231146,97211,0.4206,121863,0.5272
JASA_2026_1377,Nonparametric predictive inference for discrete data via Metropolis-adjusted Dirichlet sequences,JASA,2026,Duke University | University of Milano-Bicocca,Bayesian Methods and Mixture Models,0,94.403652,99787,11745,0.1177,23282,0.2333
JRSSB_2023_1378,Estimating heterogeneous treatment effects with right-censored data via causal survival forests,JRSSB,2023,Stanford University | University of Illinois Urbana-Champaign | University of North Carolina at Chapel Hill | Zhejiang University,Advanced Causal Inference Techniques,90,99.787079,97617,20056,0.2055,27336,0.28
JRSSB_2023_1379,Estimating means of bounded random variables by betting,JRSSB,2023,Carnegie Mellon University,Advanced Bandit Algorithms Research,79,99.37392,268952,54533,0.2028,68285,0.2539
JRSSB_2024_1380,Safe testing,JRSSB,2024,Centrum Wiskunde & Informatica | Leiden University | Mathematical Institute of the Slovak Academy of Sciences | University of Twente | Vrije Universiteit Amsterdam,Bayesian Modeling and Causal Inference,57,99.377197,85804,0,0.0,25279,0.2946
JRSSB_2023_1381,Vintage factor analysis with Varimax performs statistical inference,JRSSB,2023,University of Wisconsin–Madison,Face and Expression Recognition,51,96.522567,373047,151703,0.4067,238570,0.6395
JRSSB_2023_1382,Modelling matrix time series via a tensor CP-decomposition,JRSSB,2023,London School of Economics and Political Science | Southwestern University of Finance and Economics | Zhejiang Gongshang University,Tensor decomposition and applications,38,98.812352,300333,10733,0.0357,169451,0.5642
JRSSB_2023_1383,Conformalized survival analysis,JRSSB,2023,Stanford University | University of Chicago,Statistical Methods and Inference,36,98.899102,197078,26214,0.133,70521,0.3578
JRSSB_2024_1387,Automatic change-point detection in time series via deep learning,JRSSB,2024,Lancaster University | London School of Economics and Political Science,Time Series Analysis and Forecasting,27,98.492329,127252,20627,0.1621,30506,0.2397
JRSSB_2024_1388,CP factor model for dynamic tensors,JRSSB,2024,"Environmental and Occupational Health Sciences Institute | Rutgers, The State University of New Jersey | University of Hong Kong | University of Notre Dame",Tensor decomposition and applications,16,96.403712,215632,57315,0.2658,184856,0.8573
JRSSB_2024_1389,Doubly robust calibration of prediction sets under covariate shift,JRSSB,2024,Carnegie Mellon University | University of Pennsylvania,Advanced Statistical Methods and Models,14,98.379709,487432,109190,0.224,226388,0.4645
JRSSB_2023_1390,Quasi-Newton updating for large-scale distributed learning,JRSSB,2023,Peking University | Renmin University of China | Shanghai University of Finance and Economics,Sparse and Compressive Sensing Techniques,11,87.339068,127500,7610,0.0597,30367,0.2382
JRSSB_2025_1391,Conformal prediction with conditional guarantees,JRSSB,2025,Sequoia (United States) | Stanford University,Statistical Methods and Inference,11,99.614945,196195,74150,0.3779,74854,0.3815
JRSSB_2023_1393,Computationally efficient and data-adaptive changepoint inference in high dimension,JRSSB,2023,East China Normal University | Nankai University,Statistical Methods and Inference,8,90.888785,125508,36296,0.2892,54797,0.4366
JRSSB_2023_1394,Testing for the Markov property in time series via deep conditional generative learning,JRSSB,2023,"London School of Economics and Political Science | University of California, Berkeley",Generative Adversarial Networks and Image Synthesis,8,76.457782,151918,6729,0.0443,56727,0.3734
JRSSB_2024_1396,Engression: extrapolation through the lens of distributional regression,JRSSB,2024,ETH Zurich,Bayesian Methods and Mixture Models,7,90.193798,329443,64446,0.1956,58934,0.1789
JRSSB_2025_1398,Unbiased and consistent nested sampling via sequential Monte Carlo,JRSSB,2025,Queensland University of Technology | The University of Queensland | University of Warwick,Mathematical Approximation and Integration,21,79.85766699999999,100053,15878,0.1587,22908,0.229
JRSSB_2023_1399,Fast and fair simultaneous confidence bands for functional parameters,JRSSB,2023,Pennsylvania State University | University of Bonn,Advanced Statistical Methods and Models,19,94.432037,218525,14873,0.0681,121009,0.5538
JRSSB_2023_1401,Bayesian predictive decision synthesis,JRSSB,2023,Duke University | Statistical and Applied Mathematical Sciences Institute,Forecasting Techniques and Applications,19,94.812884,90109,0,0.0,9173,0.1018
JRSSB_2023_1402,Autoregressive optimal transport models,JRSSB,2023,"University of California, Davis | University of Notre Dame",Point processes and geometric inequalities,18,98.831338,139129,27398,0.1969,53672,0.3858
JRSSB_2023_1403,Identifying the latent space geometry of network models through analysis of curvature,JRSSB,2023,Abdul Latif Jameel Poverty Action Lab | Stanford University | University of Washington,Complex Network Analysis Techniques,16,88.087421,204139,21665,0.1061,56125,0.2749
JRSSB_2024_1406,Semi-parametric tensor factor analysis by iteratively projected singular value decomposition,JRSSB,2024,Fudan University | Hong Kong University of Science and Technology | New York University | Princeton University | University of Hong Kong | Washington State University,Tensor decomposition and applications,15,96.283391,389384,147735,0.3794,198000,0.5085
JRSSB_2023_1408,Proximal causal inference for complex longitudinal studies,JRSSB,2023,Peking University | University of Michigan | University of Pennsylvania,Advanced Causal Inference Techniques,13,94.650184,150278,0,0.0,19270,0.1282
JRSSB_2023_1410,Adaptive bootstrap tests for composite null hypotheses in the mediation pathway analysis,JRSSB,2023,University of Michigan | University of Wisconsin–Madison,Advanced Causal Inference Techniques,12,95.5027,418814,38302,0.0915,156015,0.3725
JRSSB_2023_1411,Estimating and improving dynamic treatment regimes with a time-varying instrumental variable,JRSSB,2023,Fred Hutch Cancer Center | University of Pennsylvania,Advanced Causal Inference Techniques,11,90.148525,517268,101779,0.1968,344834,0.6666
JRSSB_2023_1413,Robust estimation and inference for expected shortfall regression with many regressors,JRSSB,2023,Decision Sciences (United States) | University of Illinois Chicago | University of Michigan | Washington University in St. Louis,Statistical Methods and Inference,11,94.022642,242622,11046,0.0455,45808,0.1888
JRSSB_2024_1414,Statistical inference for multivariate extremes via a geometric approach,JRSSB,2024,Lancaster City Council | Lancaster University,Hydrology and Drought Analysis,11,91.068096,137401,0,0.0,34393,0.2503
JRSSB_2023_1416,Bayesian Pyramids: identifiable multilayer discrete latent structure models for discrete data,JRSSB,2023,Columbia University | Duke University,Gene expression and cancer classification,10,81.618221,222775,35520,0.1594,71797,0.3223
JRSSB_2023_1417,Causal inference on distribution functions,JRSSB,2023,National University of Singapore | University of Toronto,Advanced Causal Inference Techniques,10,92.854175,161441,17124,0.1061,52648,0.3261
JRSSB_2023_1418,Causal inference with invalid instruments: post-selection problems and a solution using searching and sampling,JRSSB,2023,"Rutgers, The State University of New Jersey",Advanced Causal Inference Techniques,10,92.807172,364687,0,0.0,102719,0.2817
JRSSB_2023_1419,Consistent and fast inference in compartmental models of epidemics using Poisson Approximate Likelihoods,JRSSB,2023,Lancaster University | University of Bristol,COVID-19 epidemiological studies,10,85.01421500000001,382376,148702,0.3889,175236,0.4583
JRSSB_2023_1420,Bayesian fusion: scalable unification of distributed statistical analyses,JRSSB,2023,Newcastle University | The Alan Turing Institute | University of Essex | University of Warwick,Statistical Methods and Bayesian Inference,9,88.61759099999999,302500,38230,0.1264,54034,0.1786
JRSSB_2023_1421,Parameterizing and simulating from causal models,JRSSB,2023,Leibniz Institute for Prevention Research and Epidemiology - BIPS | University of Bremen | University of Oxford,Advanced Causal Inference Techniques,9,89.96217,250555,11638,0.0464,77245,0.3083
JRSSB_2023_1422,Image response regression via deep neural networks,JRSSB,2023,"University of California, Berkeley | University of Michigan | University of Pennsylvania",Statistical Methods and Inference,9,91.953368,92472,3477,0.0376,12790,0.1383
JRSSB_2023_1424,Non-agency interventions for causal mediation in the presence of intermediate confounding,JRSSB,2023,New York University,Advanced Causal Inference Techniques,9,92.516618,151301,31038,0.2051,37497,0.2478
JRSSB_2023_1425,Ensemble methods for testing a global null,JRSSB,2023,Columbia University | Harvard University | Southwestern University of Finance and Economics,Statistical Methods and Inference,9,92.532198,109173,2596,0.0238,14306,0.131
JRSSB_2024_1426,Bayesian model selection via mean-field variational approximation,JRSSB,2024,University of Illinois Urbana-Champaign,Statistical Methods and Bayesian Inference,9,96.571795,242382,10094,0.0416,172713,0.7126
JRSSB_2024_1427,On the instrumental variable estimation with many weak and invalid instruments,JRSSB,2024,Chinese University of Hong Kong | University of Oxford,Image and Signal Denoising Methods,9,88.018799,212849,78390,0.3683,115713,0.5436
