paper_id,title,journal_short,publication_year,institution_names,primary_topic,cited_by_count,citation_percentile,total_valid_chars,exact_math_chars,exact_math_density,broad_math_chars,broad_math_density
JASA_2023_0763,Bayesian Nonparametric Common Atoms Regression for Generating Synthetic Controls in Clinical Trials,JASA,2023,"Neurological Surgery | The University of Texas MD Anderson Cancer Center | The University of Texas at Austin | The University of Texas at Dallas | University of California, San Francisco",Statistical Methods and Inference,12,94.80162,191881,3525,0.0184,121803,0.6348
JASA_2023_0764,Poisson-FOCuS: An Efficient Online Method for Detecting Count Bursts with Application to Gamma Ray Burst Detection,JASA,2023,Lancaster University | National Institute for Astrophysics | University of Udine,Gamma-ray bursts and supernovae,12,86.73995599999999,82964,14462,0.1743,14261,0.1719
JASA_2023_0765,Heterogeneous Distributed Lag Models to Estimate Personalized Effects of Maternal Exposures to Air Pollution,JASA,2023,Colorado State University | Columbia University | Harvard University,Air Quality and Health Impacts,11,81.07661,92299,0,0.0,4720,0.0511
JASA_2023_0766,High-Dimensional Time Series Segmentation via Factor-Adjusted Vector Autoregressive Modeling,JASA,2023,Durham University | Lancaster University | University of Bristol,Complex Systems and Time Series Analysis,11,96.145109,248209,75579,0.3045,109880,0.4427
JASA_2023_0767,Gaussian Approximation and Spatially Dependent Wild Bootstrap for High-Dimensional Spatial Data,JASA,2023,Cornell University | The University of Tokyo | University of Illinois Urbana-Champaign,Statistical Methods and Inference,10,90.138139,283023,54396,0.1922,165658,0.5853
JASA_2023_0768,Compositional Graphical Lasso Resolves the Impact of Parasitic Infection on Gut Microbial Interaction Networks in a Zebrafish Model,JASA,2023,Oregon State University,Metabolomics and Mass Spectrometry Studies,10,81.569175,111878,6381,0.057,9515,0.085
JASA_2023_0770,Cohesion and Repulsion in Bayesian Distance Clustering,JASA,2023,A*STAR Graduate Academy | Mathematical Institute of the Slovak Academy of Sciences | Museum of the History of Science | National University of Singapore | University College London | University of Oxford | Yale-NUS College,Bayesian Methods and Mixture Models,9,85.430662,56894,1396,0.0245,4901,0.0861
JASA_2023_0771,Estimation and Inference of Extremal Quantile Treatment Effects for Heavy-Tailed Distributions,JASA,2023,ETH Zurich | University of Geneva,Advanced Causal Inference Techniques,9,91.514333,256551,114433,0.446,112729,0.4394
JASA_2023_0772,Anytime-Valid Tests of Conditional Independence Under Model-X,JASA,2023,Centrum Wiskunde & Informatica | ETH Zurich | Leiden University | University of Applied Sciences Leiden,Statistical Methods in Clinical Trials,8,90.600332,107419,20895,0.1945,24005,0.2235
JASA_2023_0774,Bayesian Inference on High-Dimensional Multivariate Binary Responses,JASA,2023,Duke University | Purdue University West Lafayette,Statistical Methods and Bayesian Inference,8,90.864338,211054,35415,0.1678,66396,0.3146
JASA_2023_0776,Frequency Detection and Change Point Estimation for Time Series of Complex Oscillation,JASA,2023,Duke University | University of Toronto,Complex Systems and Time Series Analysis,7,93.469472,234281,103758,0.4429,183149,0.7817
JASA_2025_0777,Design-Based Uncertainty for Quasi-Experiments,JASA,2025,John Brown University | Massachusetts Institute of Technology,Advanced Causal Inference Techniques,7,92.578009,218877,51850,0.2369,64593,0.2951
JASA_2023_0779,Distributed Inference for Spatial Extremes Modeling in High Dimensions,JASA,2023,North Carolina State University,Statistical Methods and Inference,7,88.88427399999999,174867,6608,0.0378,51552,0.2948
JASA_2023_0780,Statistical Inference for Maximin Effects: Identifying Stable Associations across Multiple Studies,JASA,2023,"Rutgers, The State University of New Jersey",Genetic and phenotypic traits in livestock,7,88.339742,351558,0,0.0,166982,0.475
JASA_2024_0782,Stochastic Low-Rank Tensor Bandits for Multi-Dimensional Online Decision Making,JASA,2024,Amazon (Germany) | Amazon (United States) | Emory University | Google DeepMind (United Kingdom) | Purdue University West Lafayette,Advanced Bandit Algorithms Research,7,91.576904,159637,8824,0.0553,33064,0.2071
JASA_2023_0784,Hypotheses Testing from Complex Survey Data Using Bootstrap Weights: A Unified Approach,JASA,2023,Carleton University | Iowa State University | Xiamen University,Statistical Methods and Bayesian Inference,6,83.194848,282232,120537,0.4271,199422,0.7066
JASA_2023_0785,Kernel Estimation of Bivariate Time-Varying Coefficient Model for Longitudinal Data with Terminal Event,JASA,2023,"University of California, Irvine | University of Michigan–Ann Arbor",Statistical Methods and Inference,6,86.387,71208,3145,0.0442,17553,0.2465
JASA_2023_0787,Uniform Inference for Kernel Density Estimators with Dyadic Data,JASA,2023,Princeton University | Tsinghua University,Statistical Methods and Inference,6,85.656419,406785,265018,0.6515,201798,0.4961
JASA_2024_0788,Statistical Inference for Hüsler–Reiss Graphical Models Through Matrix Completions,JASA,2024,University of Geneva,Financial Risk and Volatility Modeling,6,91.876572,196165,53906,0.2748,54572,0.2782
JASA_2024_0790,Spatial Modeling and Future Projection of Extreme Precipitation Extents,JASA,2024,"Biostatistique et processus spatiaux | ETH Zurich | Institut National de Recherche pour l'Agriculture, l'Alimentation et l'Environnement | Institute of Atmospheric Sciences and Climate | King Abdullah University of Science and Technology | Physikalisch-Meteorologisches Observatorium Davos | Swiss Federal Institute for Forest, Snow and Landscape Research | UNSW Sydney",Climate variability and models,6,82.655486,95304,980,0.0103,6797,0.0713
JASA_2023_0792,Ideal Bayesian Spatial Adaptation,JASA,2023,University of Chicago | University of Oxford | Université Paris Dauphine-PSL,Image and Signal Denoising Methods,5,61.837783,231726,37724,0.1628,102037,0.4403
JASA_2023_0793,Higher-Order Least Squares: Assessing Partial Goodness of Fit of Linear Causal Models,JASA,2023,Columbia University | ETH Zurich,Bayesian Modeling and Causal Inference,5,77.09195100000001,193980,0,0.0,145100,0.748
JASA_2023_0794,Statistical Inferences for Complex Dependence of Multimodal Imaging Data,JASA,2023,Academy of Mathematics and Systems Science | Chinese Academy of Sciences | Southwestern University of Finance and Economics | University of Michigan,Functional Brain Connectivity Studies,5,70.534527,227713,3131,0.0137,89109,0.3913
JASA_2024_0797,A Composite Likelihood-Based Approach for Change-Point Detection in Spatio-Temporal Processes,JASA,2024,Chinese University of Hong Kong | Hang Seng University of Hong Kong | University of Hong Kong | University of Notre Dame | University of South Carolina,Statistical Methods and Inference,5,90.98966,506740,185409,0.3659,179874,0.355
JASA_2024_0799,An Interpretable and Efficient Infinite-Order Vector Autoregressive Model for High-Dimensional Time Series,JASA,2024,University of Connecticut,Neural Networks and Applications,5,86.07962500000001,394633,55677,0.1411,226047,0.5728
JASA_2024_0801,Estimating Trans-Ancestry Genetic Correlation with Unbalanced Data Resources,JASA,2024,Purdue University West Lafayette | University of North Carolina at Chapel Hill | University of Pennsylvania,Genetic Associations and Epidemiology,5,86.808079,268045,4266,0.0159,45905,0.1713
JASA_2024_0802,Randomness of Shapes and Statistical Inference on Shapes via the Smooth Euler Characteristic Transform,JASA,2024,Brown University | John Brown University | Microsoft (United States) | Microsoft Research (United Kingdom) | Microsoft Research New England (United States),Topological and Geometric Data Analysis,5,82.137642,277693,50004,0.1801,80712,0.2907
JASA_2024_0803,Mediation Analysis with the Mediator and Outcome Missing Not at Random,JASA,2024,"Beijing Institute of Mathematical Sciences and Applications | Colorado School of Public Health | Institute of Mathematical Sciences | Tsinghua University | University of California, Berkeley",Advanced Causal Inference Techniques,5,92.117206,143708,4663,0.0324,41788,0.2908
JASA_2024_0804,Matrix Completion When Missing Is Not at Random and Its Applications in Causal Panel Data Models,JASA,2024,Columbia University,Spatial and Panel Data Analysis,5,95.550934,37375,0,0.0,1075,0.0288
JASA_2024_0806,A Sparse Beta Regression Model for Network Analysis,JASA,2024,University of Warwick,Complex Network Analysis Techniques,5,80.32452500000001,278386,64296,0.231,140174,0.5035
JASA_2024_0807,Inferring Covariance Structure from Multiple Data Sources via Subspace Factor Analysis,JASA,2024,Duke University | The University of Texas at Dallas,Gene expression and cancer classification,5,77.68637000000001,186175,54724,0.2939,85332,0.4583
JASA_2024_0808,eDNAPlus: A Unifying Modeling Framework for DNA-based Biodiversity Monitoring,JASA,2024,Chinese Academy of Sciences | Kunming Institute of Zoology | Lancaster University | Oregon Department of Fish and Wildlife | Oregon State University | University College London | University of Chinese Academy of Sciences | University of East Anglia | University of Essex | University of Kent,Environmental DNA in Biodiversity Studies,5,87.811254,248000,24980,0.1007,143105,0.577
JASA_2023_0811,Value Enhancement of Reinforcement Learning via Efficient and Robust Trust Region Optimization,JASA,2023,Decision Sciences (United States) | George Washington University | London School of Economics and Political Science | Shanghai University of Finance and Economics,Advanced Bandit Algorithms Research,4,78.089665,236652,3984,0.0168,96653,0.4084
JASA_2023_0812,A General Framework for Circular Local Likelihood Regression,JASA,2023,KU Leuven | Statistics Belgium | Universidade de Santiago de Compostela,Bayesian Methods and Mixture Models,4,76.14681,148649,37263,0.2507,52050,0.3502
JASA_2023_0813,Doubly Robust Interval Estimation for Optimal Policy Evaluation in Online Learning,JASA,2023,"North Carolina State University | University of California, Irvine",Advanced Bandit Algorithms Research,4,79.154985,210602,1384,0.0066,124912,0.5931
JASA_2023_0814,Minimum Resource Threshold Policy Under Partial Interference,JASA,2023,University of Pennsylvania | University of Wisconsin–Madison,Advanced Wireless Network Optimization,4,65.31590299999999,179630,5267,0.0293,57578,0.3205
JASA_2025_0815,Robust Bayesian Modeling of Counts with Zero Inflation and Outliers: Theoretical Robustness and Efficient Computation,JASA,2025,Keio University | Kyoto University | The University of Tokyo,Statistical Methods and Bayesian Inference,4,97.617938,111636,18690,0.1674,40041,0.3587
JASA_2023_0817,"Unified Unconditional Regression for Multivariate Quantiles, M-Quantiles, and Expectiles",JASA,2023,European University of Rome | Sapienza University of Rome | University of Pisa | University of Southampton,Advanced Statistical Methods and Models,3,77.669298,261917,5308,0.0203,44210,0.1688
JASA_2023_0818,Latent Multimodal Functional Graphical Model Estimation,JASA,2023,Stanford University | University of Chicago | University of Illinois Urbana-Champaign,Functional Brain Connectivity Studies,3,63.34339799999999,427837,190597,0.4455,325371,0.7605
JASA_2023_0819,A Regression-Based Approach to Robust Estimation and Inference for Genetic Covariance,JASA,2023,Cancer Research And Biostatistics | Harvard University | Renmin University of China | University of Pennsylvania,Genetic and phenotypic traits in livestock,3,79.924519,113725,0,0.0,20538,0.1806
JASA_2024_0821,Efficient Nonparametric Estimation of Stochastic Policy Effects with Clustered Interference,JASA,2024,University of Michigan | University of North Carolina at Chapel Hill,Advanced Causal Inference Techniques,3,85.33517499999999,264740,10662,0.0403,142196,0.5371
JASA_2024_0822,Doubly Robust Augmented Model Accuracy Transfer Inference with High Dimensional Features,JASA,2024,Bentley University | Columbia University | Harvard University | National University of Singapore,Domain Adaptation and Few-Shot Learning,3,78.889188,80953,4238,0.0524,35044,0.4329
JASA_2024_0824,A Model-Agnostic Graph Neural Network for Integrating Local and Global Information,JASA,2024,"University of California, Irvine",Advanced Graph Neural Networks,3,80.320237,80299,0,0.0,7378,0.0919
JASA_2024_0825,On Optimality of Mallows Model Averaging,JASA,2024,Renmin University of China | Tsinghua University,Stochastic processes and financial applications,3,84.025913,244549,29956,0.1225,120881,0.4943
JASA_2024_0826,Euclidean Mirrors and Dynamics in Network Time Series,JASA,2024,Johns Hopkins Medicine | Johns Hopkins University | Johns Hopkins University Applied Physics Laboratory | University of Virginia,Complex Network Analysis Techniques,3,71.976053,234594,14296,0.0609,62804,0.2677
JASA_2024_0827,Iterative Methods for Vecchia-Laplace Approximations for Latent Gaussian Process Models,JASA,2024,ETH Zurich | Lucerne University of Applied Sciences and Arts | University of Basel,Gaussian Processes and Bayesian Inference,3,80.691911,136334,18345,0.1346,51406,0.3771
JASA_2024_0828,Additive Covariance Matrix Models: Modeling Regional Electricity Net-Demand in Great Britain,JASA,2024,Statistical and Applied Mathematical Sciences Institute | University of Bristol | University of Glasgow | University of Trieste | University of Udine,Electric Power System Optimization,3,67.89618899999999,146326,0,0.0,85361,0.5834
JASA_2024_0829,Spatio-Temporal Modeling for Record-Breaking Temperature Events in Spain,JASA,2024,Duke University | Universidad de Zaragoza,Meteorological Phenomena and Simulations,3,75.841002,132598,0,0.0,21197,0.1599
JASA_2024_0830,High-Dimensional Knockoffs Inference for Time Series Data,JASA,2024,"Academia Sinica | Institute of Statistical Science, Academia Sinica | National Tsing Hua University | University of Southern California",Time Series Analysis and Forecasting,3,76.642104,284726,18049,0.0634,121279,0.4259
JASA_2025_0832,Partially Exchangeable Stochastic Block Models for (Node-Colored) Multilayer Networks,JASA,2025,"Bocconi University | University of Maryland, College Park",Complex Network Analysis Techniques,3,92.400052,187261,14848,0.0793,41201,0.22
JASA_2025_0833,Testing Elliptical Models in High Dimensions,JASA,2025,,Soil Geostatistics and Mapping,3,81.038414,168921,10548,0.0624,84166,0.4983
JASA_2025_0834,Debiasing Watermarks for Large Language Models via Maximal Coupling,JASA,2025,Argonne National Laboratory | King University | Peking University | Quantitative BioSciences | University of Pennsylvania,Topic Modeling,3,95.962872,126897,15113,0.1191,18741,0.1477
JASA_2025_0835,Bayesian Geostatistics Using Predictive Stacking,JASA,2025,"Columbia University | University of California, Los Angeles | University of Southern California",Soil Geostatistics and Mapping,3,82.578622,223019,31735,0.1423,104546,0.4688
JASA_2024_0836,Robust Permutation Tests in Linear Instrumental Variables Regression,JASA,2024,York University,International Development and Aid,2,87.654764,81006,2646,0.0327,19111,0.2359
JASA_2023_0839,Smoothness-Penalized Deconvolution (SPeD) of a Density Estimate,JASA,2023,Cornell University,Statistical Methods and Inference,2,77.897798,2388682,84967,0.0356,77533,0.0325
JASA_2024_0841,Enhanced Response Envelope via Envelope Regularization,JASA,2024,University of Minnesota | University of Southern California,Sparse and Compressive Sensing Techniques,2,63.935624,95376,2093,0.0219,23299,0.2443
JASA_2025_0842,Fast Signal Region Detection With Application to Whole Genome Association Studies,JASA,2025,Columbia University | King University | Peking University,Gene expression and cancer classification,2,78.80419400000001,119076,0,0.0,15605,0.1311
JASA_2025_0843,Random Effects Model-Based Sufficient Dimension Reduction for Independent Clustered Data,JASA,2025,Australian National University | The University of Sydney,Bayesian Methods and Mixture Models,2,93.196819,159529,3909,0.0245,133375,0.8361
JASA_2025_0844,Data Fusion Using Weakly Aligned Sources,JASA,2025,Cape Town HVTN Immunology Laboratory / Hutchinson Centre Research Institute of South Africa | Fred Hutch Cancer Center | Harvard University | University of Washington,Statistical Methods and Inference,2,93.128253,167324,42874,0.2562,69028,0.4125
JASA_2025_0845,"Positive and Unlabeled Data: Model, Estimation, Inference, and Classification",JASA,2025,East China Normal University | Iowa State University | University of Waterloo,Machine Learning and Data Classification,2,93.285705,74997,2168,0.0289,13318,0.1776
JASA_2025_0846,Cutting Feedback in Misspecified Copula Models,JASA,2025,Monash University | National University of Singapore | The University of Melbourne,Financial Risk and Volatility Modeling,2,91.583815,207610,14994,0.0722,38588,0.1859
JASA_2025_0848,Tail Calibration of Probabilistic Forecasts,JASA,2025,ETH Zurich | KU Leuven | University of Bern,Forecasting Techniques and Applications,2,92.505483,137638,27905,0.2027,115295,0.8377
JASA_2025_0849,The ICML 2023 Ranking Experiment: Examining Author Self-Assessment in ML/AI Peer Review,JASA,2025,California University of Pennsylvania | Massachusetts Institute of Technology | New York University | Princeton University | University of North Carolina at Chapel Hill | University of Pennsylvania | University of Wisconsin–Madison,Topic Modeling,2,93.961678,104282,0,0.0,6019,0.0577
JASA_2025_0850,Conformal Prediction for Network-Assisted Regression,JASA,2025,University of Michigan | Washington University in St. Louis,Advanced Graph Neural Networks,2,94.048805,90370,5602,0.062,24454,0.2706
JASA_2025_0851,Communication-Efficient Distributed Estimation and Inference for Cox’s Model,JASA,2025,Princeton University,Distributed Sensor Networks and Detection Algorithms,2,90.702602,156676,75423,0.4814,78974,0.5041
JASA_2025_0852,Estimation of Out-of-Sample Sharpe Ratio for High Dimensional Portfolio Optimization,JASA,2025,University of Hong Kong | University of Michigan,Financial Markets and Investment Strategies,2,93.264309,295809,54248,0.1834,106633,0.3605
JASA_2025_0853,Efficient Distributed Learning over Decentralized Networks with Convoluted Support Vector Machine,JASA,2025,Renmin University of China | University of Michigan,Sparse and Compressive Sensing Techniques,2,87.62676499999999,121146,0,0.0,18458,0.1524
JASA_2026_0854,Network Regression and Supervised Centrality Estimation,JASA,2026,California University of Pennsylvania | Tsinghua University | University of Hong Kong | University of Notre Dame | Washington University in St. Louis,Game Theory and Applications,1,98.33465,544828,173320,0.3181,334568,0.6141
JASA_2023_0855,Dynamic Matrix Recovery,JASA,2023,Academy of Mathematics and Systems Science | Chinese Academy of Sciences | King University | Peking University,Sparse and Compressive Sensing Techniques,1,50.03691500000001,197970,3811,0.0193,141672,0.7156
JASA_2024_0857,Rational Kriging,JASA,2024,Georgia Institute of Technology,Probabilistic and Robust Engineering Design,1,67.919129,51356,406,0.0079,9840,0.1916
JASA_2024_0859,Statistical Inference for Networks of High-Dimensional Point Processes,JASA,2024,Seattle University | University of Chicago | University of Washington,Point processes and geometric inequalities,1,72.428135,232015,118515,0.5108,123259,0.5313
JASA_2024_0860,Two Sample Test for Covariance Matrices in Ultra-High Dimension,JASA,2024,"University of California, Davis",Random Matrices and Applications,1,74.50796600000001,137053,26880,0.1961,41077,0.2997
JASA_2024_0861,Adaptive Testing for High-Dimensional Data,JASA,2024,Texas A&M University | Two Sigma Investments (United States) | University of Illinois Urbana-Champaign,Statistical Methods and Inference,1,75.65727799999999,138227,10981,0.0794,105965,0.7666
JASA_2025_0865,High-Dimensional Expected Shortfall Regression,JASA,2025,University of Illinois Chicago | University of Michigan | Washington University in St. Louis,Statistical Methods and Inference,1,83.41457199999999,187238,13048,0.0697,123598,0.6601
JASA_2025_0866,Estimation of Over-Parameterized Models from an Auto-Modeling Perspective,JASA,2025,,Advanced Multi-Objective Optimization Algorithms,1,79.592931,441476,13072,0.0296,382307,0.866
JASA_2025_0867,Multi-Dimensional Domain Generalization with Low-Rank Structures,JASA,2025,Renmin University of China | Rutgers Sexual and Reproductive Health and Rights,Advanced Numerical Methods in Computational Mathematics,1,71.511826,86695,7871,0.0908,25095,0.2895
JASA_2025_0869,Estimating Heterogeneous Causal Mediation Effects with Bayesian Decision Tree Ensembles,JASA,2025,The University of Texas at Austin,Advanced Causal Inference Techniques,1,85.76143499999999,90398,0,0.0,11040,0.1221
JASA_2025_0871,Integrated Path Stability Selection,JASA,2025,Harvard University,Fault Detection and Control Systems,1,79.319959,118428,15665,0.1323,26272,0.2218
JASA_2025_0872,"Additive Multi-Index Gaussian Process Modeling, with Application to Multi-Physics Surrogate Modeling of the Quark-Gluon Plasma",JASA,2025,Duke University | Vanderbilt University,Gaussian Processes and Bayesian Inference,1,89.81922399999999,214469,990,0.0046,29985,0.1398
JASA_2025_0873,Debiased Calibration Estimation Using Generalized Entropy in Survey Sampling,JASA,2025,Iowa State University | King University | Korea Military Academy | Peking University,Survey Sampling and Estimation Techniques,1,89.017929,124321,6306,0.0507,35184,0.283
JASA_2025_0875,A Bayesian Nonparametric Approach to Mediation and Spillover Effects with Multiple Mediators in Cluster-Randomized Trials,JASA,2025,Yale University,Advanced Causal Inference Techniques,1,89.390921,297424,41182,0.1385,252503,0.849
JASA_2025_0878,Policy Learning with Distributional Welfare,JASA,2025,Communication University of Zhejiang | University of Bristol | Zhejiang University,Advanced Causal Inference Techniques,1,89.39067200000001,121556,12834,0.1056,34336,0.2825
JASA_2025_0879,Spatiotemporal Besov Priors for Bayesian Inverse Problems,JASA,2025,"Arizona State University | Irvine University | University of California, Irvine | Virginia Tech",Numerical methods in inverse problems,1,92.334152,312827,80679,0.2579,186015,0.5946
JASA_2025_0881,High-Dimensional Spatial Autoregression with Latent Factors by Diversified Projections,JASA,2025,Fudan University | Peking University | Renmin University of China,Spatial and Panel Data Analysis,1,93.005892,79660,2746,0.0345,17759,0.2229
JASA_2025_0882,Consistent Least Squares Estimation in Population-Size-Dependent Branching Processes,JASA,2025,The University of Melbourne | UNSW Sydney | Universidad de Extremadura,Stochastic processes and statistical mechanics,1,92.748333,172938,0,0.0,84049,0.486
JASA_2025_0883,Conjugate Gradient Methods for High-Dimensional GLMMs,JASA,2025,Bocconi University | Decision Sciences (United States),Advanced Numerical Methods in Computational Mathematics,1,81.030108,168636,35617,0.2112,41533,0.2463
JASA_2025_0884,Linear-Cost Vecchia Approximation of Multivariate Normal Probabilities,JASA,2025,University of Houston | University of Wisconsin–Madison,Soil Geostatistics and Mapping,1,82.920175,87603,3935,0.0449,78244,0.8932
JASA_2026_0887,Balancing Weights for Causal Inference in Observational Factorial Studies,JASA,2026,"University of California, Berkeley | University of Illinois Urbana-Champaign",Advanced Causal Inference Techniques,1,98.261891,146348,37339,0.2551,53984,0.3689
JASA_2026_0888,"Contextual Dynamic Pricing: Algorithms, Optimality, and Local Differential Privacy Constraints",JASA,2026,Fudan University | University of Notre Dame | University of Warwick,Privacy-Preserving Technologies in Data,1,98.658961,388047,132411,0.3412,203175,0.5236
JASA_2026_0889,Adaptive Partition Factor Analysis,JASA,2026,Barcelona School of Economics | Universitat Pompeu Fabra,Psychometric Methodologies and Testing,1,99.19427,92603,9403,0.1015,68006,0.7344
JASA_2026_0890,Toward Interpretable Deep Generative Models via Causal Representation Learning,JASA,2026,Rutgers Sexual and Reproductive Health and Rights | University of Chicago,Explainable Artificial Intelligence (XAI),1,99.052899,114694,0,0.0,9036,0.0788
JASA_2026_0891,Scalable community detection in massive networks via predictive assignment,JASA,2026,North Carolina State University | Pennsylvania State University | University of Central Florida,Complex Network Analysis Techniques,1,98.941135,246518,10779,0.0437,199945,0.8111
JASA_2026_0892,Multi-Scale CUSUM Tests for Time Dependent Spherical Random Fields,JASA,2026,Libera Università Internazionale degli Studi Sociali Guido Carli | Sapienza University of Rome | University of Rome Tor Vergata,Theoretical and Computational Physics,1,99.060052,85208,6341,0.0744,40492,0.4752
JASA_2023_0893,Bayesian Conditional Transformation Models,JASA,2023,Quantified Uncertainty Research Institute | TU Dortmund University | University of Göttingen,Statistical Methods and Inference,8,86.134192,113090,1624,0.0144,17828,0.1576
JASA_2023_0897,A Feasibility Study of Differentially Private Summary Statistics and Regression Analyses with Evaluations on Administrative and Survey Data,JASA,2023,Florida State University | RAND Corporation | Urban Institute,Privacy-Preserving Technologies in Data,6,81.496768,170403,0,0.0,6628,0.0389
JASA_2023_0899,A Wasserstein Index of Dependence for Random Measures,JASA,2023,Bocconi University | Libera Università Internazionale degli Studi Sociali Guido Carli,Bayesian Methods and Mixture Models,5,77.286569,124865,42220,0.3381,35308,0.2828
