paper_id,title,journal_short,publication_year,institution_names,primary_topic,cited_by_count,citation_percentile,total_valid_chars,exact_math_chars,exact_math_density,broad_math_chars,broad_math_density
AOS_2025_0244,Trimmed sample means for robust uniform mean estimation and regression,AOS,2025,Instituto Nacional de Matemática Pura e Aplicada | École Nationale de la Statistique et de l'Administration Économique,Advanced Statistical Methods and Models,1,90.788361,178281,60405,0.3388,103796,0.5822
AOS_2025_0245,Yurinskii’s coupling for martingales,AOS,2025,"Princeton University | University of California, Davis | University of Cambridge",Markov Chains and Monte Carlo Methods,1,93.220629,213000,23244,0.1091,93926,0.441
AOS_2025_0246,Causality pursuit from heterogeneous environments via neural adversarial invariance learning,AOS,2025,ETH Zurich | King University | Peking University | Princeton University,Adversarial Robustness in Machine Learning,1,93.040469,468384,87096,0.1859,222074,0.4741
AOS_2023_0247,"Projective, sparse and learnable latent position network models",AOS,2023,Carnegie Mellon University | University of Connecticut,Complex Network Analysis Techniques,2,39.674073,181903,86045,0.473,93751,0.5154
AOS_2023_0248,Learning sparse graphons and the generalized Kesten–Stigum threshold,AOS,2023,"Czech Academy of Sciences, Institute of Mathematics | Institute of Mathematics and Informatics | Princeton University",Advanced Graph Neural Networks,2,50.623883000000006,83940,18380,0.219,38097,0.4539
AOS_2023_0249,Dispersal density estimation across scales,AOS,2023,Centre de Recherche en Mathématiques de la Décision | Karlsruhe Institute of Technology | Université Paris Dauphine-PSL,Statistical Methods and Bayesian Inference,1,57.46791999999999,478222,113829,0.238,384023,0.803
AOS_2023_0251,Inference on the maximal rank of time-varying covariance matrices using high-frequency data,AOS,2023,"Berlin School of Economics and Law | Czech Academy of Sciences, Institute of Mathematics | Freie Universität Berlin | Humboldt-Universität zu Berlin",Random Matrices and Applications,1,61.035451,153304,82001,0.5349,70066,0.457
AOS_2026_0252,Confounder selection via iterative graph expansion,AOS,2026,University of Cambridge | University of Michigan,Advanced Causal Inference Techniques,1,0.254777,181034,22803,0.126,107380,0.5931
AOS_2024_0254,Change acceleration and detection,AOS,2024,Queen's University | University of Illinois Urbana-Champaign,Advanced Statistical Process Monitoring,1,70.37037000000001,321384,115751,0.3602,213051,0.6629
AOS_2024_0255,Efficient and multiply robust risk estimation under general forms of dataset shift,AOS,2024,Michigan State University | University of Pennsylvania,Statistical Methods and Inference,1,73.472106,294485,110428,0.375,240983,0.8183
AOS_2023_0256,Testing nonparametric shape restrictions,AOS,2023,London School of Economics and Political Science | University of Manchester,Statistical Methods and Inference,0,0.354001,223403,30767,0.1377,84793,0.3796
AOS_2025_0257,Kurtosis-based projection pursuit for matrix-valued data,AOS,2025,Institute of Mathematical Statistics | Numerical Method (China) | TU Wien | University of Helsinki | University of Turku,Blind Source Separation Techniques,0,0.067518,234413,103350,0.4409,130940,0.5586
AOS_2026_0258,Near optimal sample complexity for matrix and tensor normal models via geodesic convexity,AOS,2026,Laboratoire d'Informatique de Paris-Nord | Ludwig-Maximilians-Universität München | Massachusetts Institute of Technology | University of Amsterdam | University of British Columbia | University of Waterloo,Tensor decomposition and applications,0,0.0,321853,128093,0.398,105059,0.3264
AOS_2024_0259,Multivariate trend filtering for lattice data,AOS,2024,Carnegie Mellon University | Google (United States),Advanced Numerical Analysis Techniques,0,0.2040199999999999,222321,51640,0.2323,62761,0.2823
AOS_2023_0264,Optimal discriminant analysis in high-dimensional latent factor models,AOS,2023,Cornell University | University of Toronto,Gene expression and cancer classification,0,27.870998000000004,238296,90849,0.3812,111011,0.4659
AOS_2025_0265,Estimation and inference in distributional reinforcement learning,AOS,2025,Department of Mathematical Sciences | King University | Peking University | Shanghai University of Finance and Economics,Advanced Bandit Algorithms Research,0,0.1110569999999999,278295,146021,0.5247,128968,0.4634
AOS_2023_0266,Robust high-dimensional tuning free multiple testing,AOS,2023,Princeton University | University of Pennsylvania | University of Pittsburgh,Statistical Methods in Clinical Trials,0,18.189356,167455,74190,0.443,76011,0.4539
AOS_2024_0267,StarTrek: Combinatorial variable selection with false discovery rate control,AOS,2024,Harvard University,Machine Learning and Data Classification,0,1.971567,569755,354245,0.6217,358370,0.629
AOS_2024_0268,"Estimation and inference for minimizer and minimum of convex functions: Optimality, adaptivity and uncertainty principles",AOS,2024,University of Pennsylvania,Advanced Control Systems Optimization,0,2.37546,81465,4903,0.0602,20773,0.255
AOS_2024_0271,Sharp adaptive and pathwise stable similarity testing for scalar ergodic diffusions,AOS,2024,Mathematical Institute of the Slovak Academy of Sciences | University of Freiburg,Statistical Methods and Inference,0,13.408373,1346105,869778,0.6461,690376,0.5129
AOS_2024_0272,Majority vote for distributed differentially private sign selection,AOS,2024,New York University | Shanghai Jiao Tong University | Shanghai University of Finance and Economics,Privacy-Preserving Technologies in Data,0,14.663109999999998,120642,34577,0.2866,40560,0.3362
AOS_2024_0273,Quantile processes and their applications in finite populations,AOS,2024,Indian Statistical Institute,Statistical Methods and Inference,0,21.060638,261313,121519,0.465,102901,0.3938
AOS_2024_0274,On the statistical complexity of sample amplification,AOS,2024,Courant Institute of Mathematical Sciences | Microsoft Research (United Kingdom) | Stanford University | University of Southern California,Neural Networks and Applications,0,21.719124,258355,16614,0.0643,79252,0.3068
AOS_2025_0276,Ensemble projection pursuit for general nonparametric regression,AOS,2025,National University of Singapore,Sparse and Compressive Sensing Techniques,0,4.100157,163605,24394,0.1491,45217,0.2764
AOS_2025_0277,Low coordinate degree algorithms I: Universality of computational thresholds for hypothesis testing,AOS,2025,Johns Hopkins University,Random Matrices and Applications,0,10.551664,174118,50336,0.2891,47459,0.2726
AOS_2025_0278,Precise error rates for computationally efficient testing,AOS,2025,"Massachusetts Institute of Technology | University of California, Davis",Random Matrices and Applications,0,10.563723,106499,32335,0.3036,27254,0.2559
AOS_2025_0284,A duality framework for analyzing random feature and two-layer neural networks,AOS,2025,Computer Algorithms for Medicine | King University | Peking University | Stanford University,Neural Networks and Applications,0,8.114588000000001,176241,47155,0.2676,81320,0.4614
AOS_2025_0285,BELIEF in dependence: Leveraging atomic linearity in data bits for rethinking generalized linear models,AOS,2025,Harvard University | University of North Carolina at Chapel Hill,Statistical Methods and Inference,0,17.252458,113901,12412,0.109,16243,0.1426
AOS_2025_0287,Sparsity meets correlation in Gaussian sequence model,AOS,2025,University of Chicago,Fractal and DNA sequence analysis,0,16.535038,340736,205256,0.6024,160721,0.4717
AOS_2025_0288,Improving knockoffs with conditional calibration,AOS,2025,"Stanford University | University of California, Berkeley",Statistical Methods in Clinical Trials,0,32.338969,192822,14418,0.0748,49754,0.258
AOS_2025_0289,Tests of missing completely at random based on sample covariance matrices,AOS,2025,University of Warwick,Random Matrices and Applications,0,32.343248,384281,207362,0.5396,207754,0.5406
AOS_2025_0290,Spectral density estimation of function-valued spatial processes,AOS,2025,Medpace (United States) | University of Michigan–Ann Arbor,Soil Geostatistics and Mapping,0,33.297719,282026,135118,0.4791,245102,0.8691
AOS_2025_0291,High-dimensional statistical inference for linkage disequilibrium score regression and its cross-ancestry extensions,AOS,2025,University of Pennsylvania,Genetic Associations and Epidemiology,0,68.10103,132527,6273,0.0473,31229,0.2356
AOS_2025_0292,The functional graphical lasso,AOS,2025,"Board of the Swiss Federal Institutes of Technology | Czech Academy of Sciences, Institute of Mathematics | Institute of Mathematics and Informatics | Vienna University of Economics and Business | École Polytechnique Fédérale de Lausanne",Statistical Methods and Inference,0,66.890648,179724,61369,0.3415,71340,0.3969
AOS_2025_0293,Symmetry: A general structure in nonparametric regression,AOS,2025,Southern California University for Professional Studies | University of Cambridge,Statistical Methods and Inference,0,64.526336,131662,24569,0.1866,44954,0.3414
AOS_2025_0295,Structured matrix learning under arbitrary entrywise dependence and estimation of Markov transition kernel,AOS,2025,Princeton University,Sparse and Compressive Sensing Techniques,0,56.986286,191066,82038,0.4294,61463,0.3217
AOS_2025_0297,Optimal sequencing depth for single-cell RNA-sequencing in Wasserstein space,AOS,2025,Chinese University of Hong Kong | University of British Columbia,Single-cell and spatial transcriptomics,0,63.748916,122427,22721,0.1856,32474,0.2653
AOS_2025_0298,Clustering by hill-climbing: Consistency results,AOS,2025,George Mason University,Advanced Clustering Algorithms Research,0,83.964474,145491,63568,0.4369,39307,0.2702
AOS_2025_0299,Online estimation with rolling validation: Adaptive nonparametric estimation with streaming data,AOS,2025,"Carnegie Mellon University | University of California, Santa Barbara",Stochastic Gradient Optimization Techniques,0,83.54123100000001,174828,71602,0.4096,72882,0.4169
AOS_2025_0300,Causal effect estimation under network interference with mean-field methods,AOS,2025,Harvard University | University of Florida,Advanced Causal Inference Techniques,0,77.403191,210949,91022,0.4315,82717,0.3921
AOS_2025_0303,"Fundamental limits of community detection from multi-view data: Multi-layer, dynamic and partially labeled block models",AOS,2025,Harvard University,Complex Network Analysis Techniques,0,69.435827,281504,85719,0.3045,123125,0.4374
AOS_2025_0304,Semi-supervised U-statistics,AOS,2025,Carnegie Mellon University | Science North,Statistical Methods and Bayesian Inference,0,77.58805199999999,308099,25034,0.0813,149107,0.484
AOS_2025_0305,Counterfactual inference in sequential experiments,AOS,2025,Cornell University | Harvard University | Massachusetts Institute of Technology | University of Michigan–Ann Arbor,Advanced Causal Inference Techniques,0,74.261871,286792,19747,0.0689,84819,0.2958
AOS_2026_0306,Solving the Poisson equation using coupled Markov chains,AOS,2026,Indian Institute of Technology Kanpur | Institut Polytechnique de Paris | Systems Analytics (United States) | University of Bristol,Markov Chains and Monte Carlo Methods,0,43.675676,248983,49135,0.1973,82012,0.3294
AOS_2026_0309,Neural networks generalize on low complexity data,AOS,2026,Stanford University,Neural Networks and Applications,0,93.227612,118232,24471,0.207,23139,0.1957
AOS_2026_0310,Pseudo-Labeling for kernel ridge regression under covariate shift,AOS,2026,Columbia University,Face and Expression Recognition,0,93.433751,177804,41520,0.2335,83124,0.4675
AOS_2026_0311,Multivariate root-n-consistent smoothing parameter-free matching estimators and estimators of inverse density weighted expectations,AOS,2026,Philipps University of Marburg | University of Rostock,Statistical Methods and Inference,0,94.112214,168510,46238,0.2744,132880,0.7886
AOS_2026_0315,Berry–Esseen bounds for design-based causal inference with possibly diverging treatment levels and varying group sizes,AOS,2026,"University of California, Berkeley",Advanced Causal Inference Techniques,0,94.366197,321542,134476,0.4182,117453,0.3653
AOS_2026_0316,Average partial effect estimation using double machine learning,AOS,2026,University of Cambridge,Statistical Methods and Inference,0,49.159918000000005,249502,129089,0.5174,105195,0.4216
AOS_2026_0317,A computational transition for detecting correlated stochastic block models by low-degree polynomials,AOS,2026,Peking University,Random Matrices and Applications,0,94.550912,288273,108093,0.375,146720,0.509
AOS_2026_0318,Information theoretic limits of robust sub-Gaussian mean estimation under star-shaped constraints,AOS,2026,Carnegie Mellon University | Science North,Statistical Methods and Inference,0,95.946579,309823,202730,0.6543,123090,0.3973
AOS_2026_0320,Confounder selection via iterative graph expansion,AOS,2026,University of Cambridge | University of Michigan,Complexity and Algorithms in Graphs,0,94.538919,181034,22803,0.126,107380,0.5931
AOS_2026_0321,Optimal convex M-estimation via score matching,AOS,2026,Rutgers Sexual and Reproductive Health and Rights | University of Bath | University of Cambridge,Statistical Methods and Inference,0,94.689448,380185,194385,0.5113,182701,0.4806
AOS_2026_0322,On the structural dimension of sliced inverse regression,AOS,2026,National University of Singapore | Tsinghua University,Statistical Methods and Inference,0,94.920342,306925,100632,0.3279,142062,0.4629
AOS_2026_0323,Inferring the dependence graph density of binary graphical models in high dimension,AOS,2026,,Complex Network Analysis Techniques,0,96.899696,316674,156478,0.4941,146685,0.4632
AOS_2026_0324,PCA for point processes,AOS,2026,Centre National de la Recherche Scientifique | Centre de Recherche en Mathématiques de la Décision | Laboratoire de Biologie et Modélisation de la Cellule | Université Paris Dauphine-PSL | École Normale Supérieure de Lyon | École Polytechnique Fédérale de Lausanne,Point processes and geometric inequalities,0,82.912866,196684,16176,0.0822,75276,0.3827
AOS_2026_0325,Spectrum-aware debiasing: A modern inference framework with applications to principal components regression,AOS,2026,Harvard University,Random Matrices and Applications,0,95.433338,361886,145460,0.4019,252184,0.6969
AOS_2026_0326,Optimal eigenvalue shrinkage in the semicircle limit,AOS,2026,New York University | Stanford University,Random Matrices and Applications,0,95.673689,270200,120967,0.4477,160873,0.5954
AOS_2026_0328,Estimation of grouped time-varying network vector autoregressive models,AOS,2026,Monash University | University of Chicago | University of Macau | Zhejiang University,Spatial and Panel Data Analysis,0,96.574902,207335,8110,0.0391,88441,0.4266
AOS_2026_0329,Reviving pseudo-inverses: Asymptotic properties of large dimensional Moore–Penrose and ridge-type inverses with applications,AOS,2026,Delft University of Technology | Linköping University,Random Matrices and Applications,0,95.772657,246165,122536,0.4978,213220,0.8662
AOS_2026_0331,Analysis of singular subspaces under random perturbations,AOS,2026,,Random Matrices and Applications,0,97.7813,326955,89046,0.2723,168080,0.5141
AOS_2026_0333,Large-scale multiple testing: Fundamental limits of false discovery rate control and compound oracle,AOS,2026,Yale University,Statistical Methods in Clinical Trials,0,95.956454,188005,49531,0.2635,86163,0.4583
AOS_2026_0334,Eigenvector overlaps in large sample covariance matrices and nonlinear shrinkage estimators,AOS,2026,Nanyang Technological University,Random Matrices and Applications,0,95.970592,283356,90652,0.3199,115183,0.4065
AOS_2026_0336,Precise asymptotics of bagging regularized M-estimators,AOS,2026,Cambridge Econometrics (United Kingdom) | Chinese University of Hong Kong | Rutgers Sexual and Reproductive Health and Rights | Stanford University | The University of Texas at Austin | University of Hong Kong,Statistical Methods and Inference,0,95.998869,339876,52293,0.1539,138883,0.4086
AOS_2026_0337,Finite- and large sample inference for model and coefficients in high-dimensional linear regression with repro samples,AOS,2026,Rutgers Sexual and Reproductive Health and Rights | University of Cincinnati,Statistical Methods and Inference,0,96.013007,342318,146374,0.4276,172886,0.505
AOS_2026_0338,Adaptive Bayesian regression on data with low intrinsic dimensionality,AOS,2026,Duke University,Gaussian Processes and Bayesian Inference,0,96.454397,367370,181492,0.494,165912,0.4516
AOS_2026_0339,Object detection under the linear subspace model with application to cryo-EM images,AOS,2026,Data Management (Italy) | Tel Aviv University,Advanced Electron Microscopy Techniques and Applications,0,75.27010800000001,100296,34320,0.3422,37757,0.3765
AOS_2026_0340,Versatile differentially private learning for general loss functions,AOS,2026,King University | Peking University | Tsinghua University,Privacy-Preserving Technologies in Data,0,96.53623,106037,8028,0.0757,25239,0.238
AOS_2026_0341,Generalized linear spectral statistics of high-dimensional sample covariance matrices and its applications,AOS,2026,University of Science and Technology of China,Random Matrices and Applications,0,96.15439,108457,11059,0.102,33203,0.3061
AOS_2026_0342,Parameter identification in linear non-Gaussian causal models under general confounding,AOS,2026,,Bayesian Modeling and Causal Inference,0,98.363488,145213,55041,0.379,105487,0.7264
BIO_2023_0347,Causal inference with misspecified exposure mappings: separating definitions and assumptions,BIO,2023,Yale University,Advanced Causal Inference Techniques,24,98.161612,272559,75830,0.2782,76147,0.2794
BIO_2023_0348,Deep Kronecker network,BIO,2023,City University of Hong Kong | University of Hong Kong,Tensor decomposition and applications,22,95.729537,159203,14879,0.0935,23507,0.1477
BIO_2024_0349,Debiasing Welch’s method for spectral density estimation,BIO,2024,Imperial College London | University of Western Australia,Blind Source Separation Techniques,19,97.207475,57686,2064,0.0358,12134,0.2103
BIO_2023_0350,Efficient estimation under data fusion,BIO,2023,University of Washington,Advanced Causal Inference Techniques,18,96.989169,178436,53632,0.3006,76269,0.4274
BIO_2023_0354,Covariate-adjusted log-rank test: guaranteed efficiency gain and universal applicability,BIO,2023,Eli Lilly (United States) | University of Washington | University of Wisconsin–Madison,Statistical Methods in Clinical Trials,12,95.264249,264052,24884,0.0942,148940,0.5641
BIO_2024_0355,Variance-based sensitivity analysis for weighting estimators results in more informative bounds,BIO,2024,"University of California, Berkeley | Yale University",Advanced Causal Inference Techniques,10,97.340557,118011,31046,0.2631,27867,0.2361
BIO_2024_0356,Consistency of common spatial estimators under spatial confounding,BIO,2024,Johns Hopkins Medicine | Johns Hopkins University,Spatial and Panel Data Analysis,8,97.259235,113972,26978,0.2367,46953,0.412
BIO_2024_0357,Promises of parallel outcomes,BIO,2024,University of Connecticut | University of Toronto,"Health Systems, Economic Evaluations, Quality of Life",6,96.055579,330150,68993,0.209,87545,0.2652
BIO_2023_0359,Semiparametric counterfactual density estimation,BIO,2023,Carnegie Mellon University,Advanced Causal Inference Techniques,18,96.284397,106096,19439,0.1832,30010,0.2829
BIO_2023_0360,Targeted optimal treatment regime learning using summary statistics,BIO,2023,North Carolina State University,Advanced Causal Inference Techniques,16,96.46344,152513,1737,0.0114,70360,0.4613
BIO_2023_0361,Statistical inference for streamed longitudinal data,BIO,2023,"North Carolina State University | University of California, Berkeley | University of Iowa",Statistical Methods and Inference,15,96.358915,118136,1538,0.013,32078,0.2715
BIO_2023_0363,Proximal mediation analysis,BIO,2023,Ghent University | Johns Hopkins University | University of Pennsylvania,Advanced Causal Inference Techniques,11,93.596801,155399,37269,0.2398,51755,0.333
BIO_2024_0365,Covariate adjustment in randomized experiments with missing outcomes and covariates,BIO,2024,"Duke University | University of California, Berkeley",Statistical Methods and Bayesian Inference,11,97.656982,145946,54210,0.3714,15459,0.1059
BIO_2023_0366,Semiparametric efficient G-estimation with invalid instrumental variables,BIO,2023,Columbia University | National University of Singapore | University of Pennsylvania,Advanced Causal Inference Techniques,10,92.745118,105796,4612,0.0436,33044,0.3123
BIO_2023_0367,Universal robust regression via maximum mean discrepancy,BIO,2023,University of Bristol | École Supérieure des Sciences Économiques et Commerciales,Advanced Statistical Methods and Models,9,90.06595,167202,72554,0.4339,70467,0.4214
BIO_2024_0370,Improving randomized controlled trial analysis via data-adaptive borrowing,BIO,2024,Eli Lilly (United States) | North Carolina State University,Advanced Causal Inference Techniques,7,95.621768,126385,14935,0.1182,51341,0.4062
BIO_2024_0371,Network-adjusted covariates for community detection,BIO,2024,National University of Singapore | Southern Methodist University,Complex Network Analysis Techniques,6,82.834232,80758,4529,0.0561,9124,0.113
BIO_2024_0372,Selective conformal inference with false coverage-statement rate control,BIO,2024,Nankai University | Shanghai Jiao Tong University,Statistical Methods and Inference,6,94.495232,381072,153214,0.4021,145936,0.383
BIO_2024_0373,Individualized dynamic latent factor model for multi-resolutional data with application to mobile health,BIO,2024,"Irvine University | Purdue University West Lafayette | University of California, Irvine",Statistical Methods and Inference,5,93.538537,92877,7113,0.0766,19269,0.2075
BIO_2023_0377,Hybrid confidence intervals for informative uniform asymptotic inference after model selection,BIO,2023,University of Colorado Boulder | University of Colorado System,Statistical Methods and Inference,4,75.173413,215716,5180,0.024,74536,0.3455
BIO_2023_0379,Nonparametric priors with full-range borrowing of information,BIO,2023,Bocconi University,Bayesian Methods and Mixture Models,4,76.09017999999999,170410,37998,0.223,123073,0.7222
BIO_2024_0415,Partially factorized variational inference for high-dimensional mixed models,BIO,2024,Bocconi University | The University of Texas at Austin,Statistical Methods and Inference,4,90.988014,112462,28175,0.2505,76813,0.683
BIO_2025_0449,The inverse Kalman filter,BIO,2025,"University of California, Santa Barbara",Inertial Sensor and Navigation,1,94.664016,61728,3605,0.0584,13914,0.2254
BIO_2025_0501,Dynamic factor analysis of high-dimensional recurrent events,BIO,2025,Columbia University | London School of Economics and Political Science | Stanford University,Advanced Statistical Modeling Techniques,1,79.398123,198461,94985,0.4786,94602,0.4767
BIO_2025_0502,Bias correction of quadratic spectral estimators,BIO,2025,Imperial College London | The University of Western Australia,Image and Signal Denoising Methods,1,76.284078,34728,1186,0.0342,10216,0.2942
BIO_2025_0503,Infinite joint species distribution models,BIO,2025,Duke University | Statistical and Applied Mathematical Sciences Institute,Species Distribution and Climate Change,1,88.74988,78797,7645,0.097,18006,0.2285
BIO_2025_0505,Robust universal inference for misspecified models,BIO,2025,Carnegie Mellon University,Bayesian Modeling and Causal Inference,1,91.18437,180678,30344,0.1679,49558,0.2743
BIO_2023_0506,Median regularity and honest inference,BIO,2023,Carnegie Mellon University,Statistical Methods and Inference,1,57.66514299999999,37530,3495,0.0931,12552,0.3345
BIO_2023_0507,Interpolating discriminant functions in high-dimensional Gaussian latent mixtures,BIO,2023,Cornell University | University of Toronto,Bayesian Methods and Mixture Models,1,53.784517,114966,35035,0.3047,86753,0.7546
BIO_2023_0516,Statistical summaries of unlabelled evolutionary trees,BIO,2023,Stanford University,Genomics and Phylogenetic Studies,0,23.058203,119440,31565,0.2643,25782,0.2159
BIO_2023_0519,Familial inference: tests for hypotheses on a family of centres,BIO,2023,Monash University | The Ohio State University,Bayesian Methods and Mixture Models,0,15.83576,89523,22576,0.2522,23420,0.2616
BIO_2024_0526,Semiparametric efficiency gains from parametric restrictions on propensity scores,BIO,2024,Massachusetts Institute of Technology,Advanced Causal Inference Techniques,0,10.36847,113397,35714,0.3149,53926,0.4756
BIO_2026_0527,Functional Principal Component Analysis for Sparse Censored Data,BIO,2026,Duke University | North Carolina State University | Statistical and Applied Mathematical Sciences Institute,Spectroscopy and Chemometric Analyses,0,0.137741,71883,559,0.0078,14542,0.2023
BIO_2024_0528,Skip sampling: subsampling in the frequency domain,BIO,2024,"United States Census Bureau | University of California, San Diego",Advanced Statistical Process Monitoring,0,12.574967,63061,0,0.0,44871,0.7115
BIO_2024_0531,Axiomatization of interventional probability distributions,BIO,2024,University College London,Bayesian Modeling and Causal Inference,0,11.310793,221694,77596,0.35,146937,0.6628
BIO_2024_0533,Boosting the power of kernel two-sample tests,BIO,2024,University of Pennsylvania,Advanced Statistical Methods and Models,0,16.843265,262033,67064,0.2559,114720,0.4378
BIO_2024_0536,Multiple conditional randomization tests for lagged and spillover treatment effects,BIO,2024,Stanford University | University of Cambridge,Advanced Causal Inference Techniques,0,18.837863,368684,44091,0.1196,108756,0.295
