paper_id,title,journal_short,publication_year,institution_names,primary_topic,cited_by_count,citation_percentile,exact_math_density,broad_math_density
JASA_2025_1170,Analyzing Whale Calling through Hawkes Process Modeling,JASA,2025,Cornell University | Dongguk University | Duke University | North Carolina State University | Southall Environmental Associates (United States) | St Nicholas Hospital,Marine animal studies overview,0,10.00471,0.0,0.1427
JASA_2025_1171,Adjacency Matrix Decomposition Clustering for Human Activity Data,JASA,2025,Institute of Public Affairs | University of Minnesota,Human Pose and Action Recognition,0,8.712010000000001,0.0,0.0462
JASA_2025_1172,Adaptation Using Spatially Distributed Gaussian Processes,JASA,2025,Bocconi University | Decision Sciences (United States) | Delft University of Technology | Institute of Applied Mathematics | Leiden University | Mathematical Institute of the Slovak Academy of Sciences,Gaussian Processes and Bayesian Inference,0,5.050319,0.1727,0.207
JASA_2025_1173,Deep Fréchet Regression,JASA,2025,"University of California, Davis",Anomaly Detection Techniques and Applications,0,5.394625,0.3226,0.3617
JASA_2025_1177,Asymptotic Guarantees for Bayesian Phylogenetic Tree Reconstruction,JASA,2025,Newcastle University | University College Cork | University of Warwick,Bayesian Methods and Mixture Models,0,5.724075,0.0186,0.3721
JASA_2025_1180,Modeling Tree Survival for Investigating Climate Change Effects,JASA,2025,Beijing Municipal Ecological and Environmental Monitoring Center | Forest Research Institute | Office of Environmental Management | University of Bath | University of Edinburgh,Forest ecology and management,0,13.745691,0.0005,0.0624
JASA_2025_1182,"Design-Based Causal Inference with Missing Outcomes: Missingness Mechanisms, Imputation-Assisted Randomization Tests, and Covariate Adjustment",JASA,2025,Courant Institute of Mathematical Sciences | New York University | University of Chicago,Advanced Causal Inference Techniques,0,13.448904,0.1842,0.2347
JASA_2025_1187,Long-Term Effect Estimation When Combining Clinical Trial and Observational Follow-Up Datasets,JASA,2025,Cancer Research Center | Cape Town HVTN Immunology Laboratory / Hutchinson Centre Research Institute of South Africa | Fred Hutch Cancer Center | University of Washington,Statistical Methods and Inference,0,16.292968,0.3098,0.4027
JASA_2025_1189,SOFARI: High-Dimensional Manifold-Based Inference,JASA,2025,California Southern University | University of Science and Technology of China | University of Southern California,Generative Adversarial Networks and Image Synthesis,0,15.444266,0.0946,0.7031
JASA_2025_1192,Improved Bounds and Inference on Optimal Regimes,JASA,2025,"Czech Academy of Sciences, Institute of Mathematics | Department of Health | Institute of Mathematics and Informatics | École Polytechnique Fédérale de Lausanne",Advanced Causal Inference Techniques,0,17.280549,0.1147,0.2288
JASA_2025_1193,Online Policy Learning and Inference by Matrix Completion,JASA,2025,Hong Kong University of Science and Technology | University of Michigan,Advanced Bandit Algorithms Research,0,21.439327,0.565,0.5841
JASA_2025_1194,Effect Aliasing in Observational Studies,JASA,2025,Harvard University | University of Pennsylvania,Advanced Causal Inference Techniques,0,17.653787,0.0869,0.2204
JASA_2025_1195,Kernel Spectral Joint Embeddings for High-Dimensional Noisy Datasets Using Duo-Landmark Integral Operators,JASA,2025,"Broad Institute | Dana-Farber Cancer Institute | Dana-Farber/Harvard Cancer Center | Harvard University | University of California, Berkeley",Image and Signal Denoising Methods,0,21.610423,0.2255,0.3067
JASA_2025_1196,A Powerful Transformation of Quantitative Responses for Biobank-Scale Association Studies,JASA,2025,Colorado State University | Southwestern University of Finance and Economics,Genetic Associations and Epidemiology,0,20.621986,0.0456,0.1219
JASA_2025_1197,Provably Efficient Posterior Sampling for Sparse Linear Regression via Measure Decomposition,JASA,2025,Stanford University | University of Pennsylvania,Sparse and Compressive Sensing Techniques,0,18.981561,0.2048,0.2623
JASA_2025_1198,Inference for Low-Rank Models Without Estimating the Rank,JASA,2025,"Princeton University | Rutgers Sexual and Reproductive Health and Rights | Rutgers, The State University of New Jersey | University of Rhode Island",Statistical Methods and Inference,0,17.492477,0.028,0.2173
JASA_2025_1199,Dimension Reduction for Large-Scale Federated Data: Statistical Rate and Asymptotic Inference,JASA,2025,Cancer Research And Biostatistics | Harvard University | Harvard University Press | National University of Singapore,Random Matrices and Applications,0,17.696153,0.1151,0.5543
JASA_2025_1200,Correction,JASA,2025,,Statistical Methods and Inference,0,18.674648,0.0,0.1962
JASA_2025_1201,The Effect of Alcohol Intake on Brain White Matter Microstructural Integrity: A New Causal Inference Framework for Incomplete Phenomic Data,JASA,2025,"Human Genome Sciences (United States) | Institute of Bioinformatics | University of Maryland, Baltimore | University of Maryland, College Park | University of Michigan",Statistical Methods and Inference,0,18.221506,0.0,0.0658
JASA_2025_1203,Inference for Dispersion and Curvature of Random Objects,JASA,2025,"University of California, Davis",Soil Geostatistics and Mapping,0,17.992782,0.0002,0.3714
JASA_2025_1207,Chain-Linked Multiple Matrix Integration via Embedding Alignment,JASA,2025,Johns Hopkins University | North Carolina State University,Sparse and Compressive Sensing Techniques,0,28.940932000000004,0.2652,0.6038
JASA_2025_1208,Simultaneous Inference for Monotone and Smoothly Time-Varying Functions Under Complex Temporal Dynamics,JASA,2025,Tsinghua University,Statistical Methods and Inference,0,21.12491,0.4273,0.4489
JASA_2025_1212,Differentially Private Sliced Inverse Regression: Minimax Optimality and Algorithm,JASA,2025,Iowa State University | Rutgers Sexual and Reproductive Health and Rights | University of Hong Kong,Privacy-Preserving Technologies in Data,0,12.546542,0.4993,0.5293
JASA_2025_1215,SMART-MC: Characterizing the Dynamics of Multiple Sclerosis Therapy Transitions Using a Covariate-Based Markov Model,JASA,2025,Harvard University | University of Pittsburgh | Virginia Commonwealth University | Virginia Commonwealth University Medical Center,Statistical Methods and Inference,0,22.794897,0.2086,0.2056
JASA_2026_1223,Possibilistic Inferential Models: A Review,JASA,2026,North Carolina State University,Multi-Agent Systems and Negotiation,0,0.543158,0.0107,0.1131
JASA_2025_1224,A Regression Framework for Studying Relationships among Attributes under Network Interference,JASA,2025,Pennsylvania State University | Trinity College Dublin,Complex Network Analysis Techniques,0,82.886213,0.0515,0.5194
JASA_2025_1225,Conditional Probability Tensor Decompositions for Multivariate Categorical Response Regression,JASA,2025,Florida State University | University of Minnesota,Tensor decomposition and applications,0,24.528302,0.0488,0.2469
JASA_2025_1226,Localizing Strictly Proper Scoring Rules,JASA,2025,Eindhoven University of Technology | Erasmus University Rotterdam | Quantitative BioSciences | Tilburg University | Tinbergen Institute | University of Amsterdam,Data Mining Algorithms and Applications,0,38.447031,0.0,0.0935
JASA_2026_1227,Successive classification learning for estimating quantile optimal treatment regimes,JASA,2026,Renmin University of China | University of Toronto,Statistical Methods and Inference,0,0.959575,0.0279,0.2138
JASA_2026_1228,Extracting Interpretable Models from Tree Ensembles: Computational and Statistical Perspectives,JASA,2026,Moscow Institute of Thermal Technology | The University of Sydney,Explainable Artificial Intelligence (XAI),0,0.636656,0.0156,0.1911
JASA_2025_1229,Cluster-Randomized Trials with Cross-Cluster Interference,JASA,2025,"University of California, Santa Cruz",Statistical Methods and Inference,0,25.630484,0.0123,0.28
JASA_2025_1230,Confidence Sets for Causal Orderings,JASA,2025,Cornell University | Mohamed bin Zayed University of Artificial Intelligence | Technical University of Munich | University of Southern California,Bayesian Modeling and Causal Inference,0,14.348531,0.3254,0.388
JASA_2025_1231,Elastic Shape Analysis of Movement Data,JASA,2025,BSCS Science Learning | Sandia National Laboratories | Sandia National Laboratories California | University of Nebraska Medical Center | Virginia Tech - Wake Forest University School of Biomedical Engineering & Sciences,Osteoarthritis Treatment and Mechanisms,0,41.357326,0.0,0.0254
JASA_2025_1232,When Does Bottom-Up Beat Top-Down in Hierarchical Community Detection?,JASA,2025,École Polytechnique Fédérale de Lausanne,Complex Network Analysis Techniques,0,22.538114,0.2649,0.3423
JASA_2025_1233,Reconstruct Ising Model With Global Optimality via SLIDE,JASA,2025,Institute of Finance Management | National Sun Yat-sen University | National University Health System | National University of Singapore | Sun Yat-sen University | University of Birmingham | University of Michigan | Yale University,Opinion Dynamics and Social Influence,0,22.541386,0.0408,0.1777
JASA_2025_1234,Bayesian Image Analysis in Fourier Space,JASA,2025,"International Computer Science Institute | King Abdullah University of Science and Technology | University of California, San Francisco",Medical Image Segmentation Techniques,0,27.963418,0.0,0.0734
JASA_2025_1236,Identification and Multiply Robust Estimation of Causal Effects via Instrumental Variables from An Auxiliary Population,JASA,2025,Beijing Technology and Business University | Renmin University of China,Advanced Causal Inference Techniques,0,27.478489,0.0612,0.1704
JASA_2025_1237,Online Auction Design Using Distribution-Free Uncertainty Quantification with Applications to E-Commerce,JASA,2025,Data Management (Italy) | University of California System,Auction Theory and Applications,0,34.677285000000005,0.1739,0.2486
JASA_2025_1239,Impact of Existence and Nonexistence of Pivot on the Coverage of Empirical Best Linear Prediction Intervals for Small Areas,JASA,2025,"Czech Academy of Sciences, Institute of Mathematics | Eastern Kentucky University | Institute of Mathematics and Informatics | Kyushu University | Methodist University | United States Congress",Advanced Causal Inference Techniques,0,29.089137,0.0152,0.1918
JASA_2025_1240,Random Pairing MLE for Estimation of Item Parameters in Rasch Model,JASA,2025,University of Chicago | Yale University,Psychometric Methodologies and Testing,0,36.723518,0.091,0.4957
JASA_2025_1243,Functional Partial Least-Squares: Adaptive Estimation and Inference,JASA,2025,University of North Carolina Health Care | Université de Montréal,Statistical Methods and Inference,0,29.093375,0.3957,0.3579
JASA_2026_1244,GS-BART: Bayesian Additive Regression Trees with Graph-split Decision Rules,JASA,2026,Texas A&M University,Bayesian Modeling and Causal Inference,0,0.939039,0.0136,0.2189
JASA_2025_1246,Risk-Sensitive Deep RL: Variance-Constrained Actor-Critic Provably Finds Globally Optimal Policy,JASA,2025,Duke University | Peking University | Pennsylvania State University | University of Science and Technology of China | Yale University,Reinforcement Learning in Robotics,0,17.640305,0.5401,0.1796
JASA_2025_1248,Reinforcement Learning with Continuous Actions Under Unmeasured Confounding,JASA,2025,"Communication University of Zhejiang | Decision Sciences (United States) | George Washington University | University of California, Irvine | University of Illinois Urbana-Champaign",Reinforcement Learning in Robotics,0,19.375362,0.0095,0.1733
JASA_2026_1250,Testing for integer integration in functional time series,JASA,2026,Macquarie University | The University of Sydney,Financial Risk and Volatility Modeling,0,0.739513,0.0,0.2195
JASA_2025_1251,A Unified Framework for Estimation of High-Dimensional Conditional Factor Models,JASA,2025,"Chinese University of Hong Kong, Shenzhen",Psychometric Methodologies and Testing,0,42.38149,0.0,0.3369
JASA_2025_1252,Deep Clustering Evaluation: How to Validate Internal Clustering Validation Measures,JASA,2025,University of Kentucky,Advanced Clustering Algorithms Research,0,19.821888,0.014,0.057
JASA_2025_1254,Covariate-Elaborated Robust Partial Information Transfer with Conditional Spike-and-Slab Prior,JASA,2025,Fudan University | University of Pennsylvania,Stochastic Gradient Optimization Techniques,0,19.822342000000003,0.0525,0.1918
JASA_2025_1255,Belted and Ensembled Neural Network for Linear and Nonlinear Sufficient Dimension Reduction,JASA,2025,Pennsylvania State University | University of Kentucky,Neural Networks and Applications,0,20.314384,0.056,0.2274
JASA_2026_1256,Learn then Decide: A Learning Approach for Designing Data Marketplaces,JASA,2026,University of California System | University of Pennsylvania,Advanced Bandit Algorithms Research,0,0.487098,0.0382,0.1289
JASA_2025_1257,Bayesian Nonparametric Quasi Likelihood,JASA,2025,The University of Texas at Austin,Bayesian Methods and Mixture Models,0,20.633947,0.1892,0.3019
JASA_2025_1258,Principal Component Analysis for Max-Stable Distributions,JASA,2025,Otto-von-Guericke University Magdeburg,Random Matrices and Applications,0,35.659705,0.3014,0.2747
JASA_2025_1260,Factor Augmented Matrix Regression,JASA,2025,New York University | Princeton University,Psychometric Methodologies and Testing,0,44.751136,0.4708,0.5075
JASA_2025_1262,The Impact of Job Stability on Monetary Poverty in Italy: Causal Small Area Estimation,JASA,2025,"Humboldt-Universität zu Berlin | University of California, Berkeley | University of Lausanne | University of Pisa | University of Toronto",Italy: Economic History and Contemporary Issues,0,45.254048,0.0653,0.2247
JASA_2025_1263,Low-Rank Online Dynamic Assortment with Dual Contextual Information,JASA,2025,John D. and Catherine T. MacArthur Foundation | Purdue University West Lafayette | University of Michigan | University of North Carolina at Chapel Hill,Optimization and Search Problems,0,42.701592,0.063,0.3051
JASA_2025_1264,Multivariate Analysis for Multiple Network Data via Semi-Symmetric Tensor PCA,JASA,2025,"Baruch College | University of California, Los Angeles",Tensor decomposition and applications,0,36.833046,0.2533,0.2783
JASA_2025_1267,Bayesian Signal Matching for Transfer Learning in ERP-Based Brain Computer Interface,JASA,2025,Emory University | University of Michigan–Ann Arbor,EEG and Brain-Computer Interfaces,0,64.022209,0.0,0.1581
JASA_2025_1268,Causality-Oriented Robustness: Exploiting General Noise Interventions,JASA,2025,ETH Zurich | University of Washington,Bayesian Modeling and Causal Inference,0,81.76549,0.2483,0.3448
JASA_2026_1270,Possibilistic Inferential Models: A Review,JASA,2026,North Carolina State University,Bayesian Modeling and Causal Inference,0,3.05249,0.0107,0.1131
JASA_2026_1274,A Latent Variable Approach to Learning High-Dimensional Multivariate Longitudinal Data,JASA,2026,Chinese University of Hong Kong | London School of Economics and Political Science,Bayesian Methods and Mixture Models,0,4.444691,0.0323,0.4618
JASA_2026_1275,Scalable Estimation of Multinomial Response Models with Random Consideration Sets,JASA,2026,University of Alberta | Washington University in St. Louis,Survey Sampling and Estimation Techniques,0,4.768056,0.1093,0.2521
JASA_2026_1276,Trans-Glasso: A Transfer Learning Approach to Precision Matrix Estimation,JASA,2026,Mohamed bin Zayed University of Artificial Intelligence | University of Chicago | University of Southern California,Face and Expression Recognition,0,4.248806,0.2176,0.4826
JASA_2026_1279,Efficient Analysis of Latent Spaces in Heterogeneous Networks,JASA,2026,Florida State University | Hong Kong University of Science and Technology | University of Wisconsin–Madison,Natural Language Processing Techniques,0,7.013033,0.1373,0.4779
JASA_2026_1281,Conditional Partial Exchangeability: A Probabilistic Framework for Multi-View Clustering,JASA,2026,Bocconi University | Foundation for Human Potential | National University of Singapore,Bayesian Methods and Mixture Models,0,7.046058,0.18,0.2216
JASA_2026_1282,Differentially Private Permutation Tests,JASA,2026,Korea Advanced Institute of Science and Technology | University of Cambridge,Cryptography and Data Security,0,7.055493,0.1722,0.4277
JASA_2026_1283,Differentially Private Sliced Inverse Regression in the Federated Paradigm,JASA,2026,South China University of Technology | Southern University of Science and Technology,Random Matrices and Applications,0,6.741045,0.2349,0.2723
JASA_2026_1284,Optimal Plug-in Gaussian Processes for Modeling Derivatives,JASA,2026,Rice University,Gaussian Processes and Bayesian Inference,0,7.862389999999999,0.4533,0.3635
JASA_2026_1288,Optimal Differentially Private Ranking from Pairwise Comparisons*,JASA,2026,,Game Theory and Voting Systems,0,4.87159,0.1108,0.4265
JASA_2026_1289,Subtype-Aware Registration of Longitudinal Electronic Health Records,JASA,2026,Duke University | Vanderbilt University,Machine Learning in Healthcare,0,8.135873,0.0,0.135
JASA_2026_1290,Bayesian Image Mediation Analysis,JASA,2026,University of Chicago | University of Michigan,Bayesian Methods and Mixture Models,0,8.187769,0.2986,0.3406
JASA_2026_1291,Searching for Local Associations while Controlling the False Discovery Rate,JASA,2026,California Southern University | Cheung Kong Graduate School of Business | Stanford University,Biomedical Text Mining and Ontologies,0,13.798816,0.0988,0.1909
JASA_2026_1293,Heterogeneous Gene Network Estimation for Single-Cell Transcriptomic Data via a Joint Regularized Deep Neural Network,JASA,2026,Shanghai University of Finance and Economics,Single-cell and spatial transcriptomics,0,14.595326,0.0,0.0792
JASA_2026_1294,Translating predictive distributions into informative priors,JASA,2026,MRC Biostatistics Unit | University of Cambridge,AI-based Problem Solving and Planning,0,39.239905,0.0,0.2022
JASA_2026_1296,Totally Concave Regression,JASA,2026,,Advanced Statistical Methods and Models,0,23.045384,0.6824,0.5835
JASA_2026_1297,Online Statistical Inference for Contextual Bandits via Stochastic Gradient Descent,JASA,2026,New York University | Purdue University West Lafayette | The University of Texas at Austin | Xi'an Jiaotong University,Advanced Bandit Algorithms Research,0,17.667193,0.362,0.3939
JASA_2026_1300,Towards Better Statistical Understanding of Watermarking LLMs,JASA,2026,Imperial College London | The University of Sydney | Virginia Tech,Advanced Steganography and Watermarking Techniques,0,47.869654,0.1585,0.1841
JASA_2026_1301,Enhanced inference for distributions and quantiles of individual treatment effects in various experiments,JASA,2026,AIDS Clinical Trials Group | University of Chicago,Statistical Methods in Clinical Trials,0,48.424311,0.3129,0.3168
JASA_2026_1304,On the Identifying Power of Generalized Monotonicity for Average Treatment Effects*,JASA,2026,University of Chicago | University of Southern California | Yale University,Advanced Causal Inference Techniques,0,85.459295,0.0332,0.3062
JASA_2026_1309,A Statistician’s Overview of Physics-Informed Neural Networks for Spatio-Temporal Data,JASA,2026,Lawrence Berkeley National Laboratory | Los Alamos National Laboratory | The University of Texas at Austin | University of Missouri,Gaussian Processes and Bayesian Inference,0,30.54078,0.0,0.1429
JASA_2026_1310,Factorial Difference-in-Differences*,JASA,2026,,Advanced Topics in Algebra,0,99.672668,0.1195,0.2201
JASA_2026_1311,Perturbation Analysis of Randomized SVD and its Applications to Statistics,JASA,2026,Duke University | North Carolina State University,Statistical Mechanics and Entropy,0,45.499828,0.1156,0.5394
JASA_2026_1312,"Out-of-Distribution Generalization under Random, Dense Distributional Shifts",JASA,2026,Stanford University,Probability and Risk Models,0,28.519656,0.1959,0.3957
JASA_2026_1315,When Less Is More: Binary Feedback Can Outperform Ordinal Comparisons in Ranking Recovery,JASA,2026,Chinese University of Hong Kong | University of Shanghai for Science and Technology | Xiamen University,Game Theory and Voting Systems,0,32.150323,0.0698,0.4388
JASA_2026_1316,Spatial Scale-Aware Tail Dependence Modeling for High-Dimensional Spatial Extremes,JASA,2026,Colorado State University | Lawrence Berkeley National Laboratory | University of Missouri,Meteorological Phenomena and Simulations,0,29.621879,0.2264,0.2578
JASA_2026_1318,Nonparametric Prior Learning in Differential Equation Modeling,JASA,2026,Huzhou University | Huzhou Vocational and Technical College | Statistical Research (United States) | Xi'an Jiaotong University,Psychometric Methodologies and Testing,0,30.140257,0.355,0.4399
JASA_2026_1319,Scalable and robust regression models for continuous proportional data,JASA,2026,Duke University | University of Jyväskylä,Advanced Statistical Methods and Models,0,37.780388,0.0848,0.2485
JASA_2026_1320,Functional-SVD for Heterogeneous Trajectories: Case Studies in Health*,JASA,2026,Duke University,Traffic control and management,0,93.122352,0.3935,0.4525
JASA_2026_1321,Residual Importance Weighted Transfer Learning for High-dimensional Linear Regression,JASA,2026,Beijing Normal University | Hong Kong Polytechnic University,Domain Adaptation and Few-Shot Learning,0,45.370054,0.0534,0.4822
JASA_2026_1322,A Physics-Informed Spatiotemporal Deep Learning Framework for Turbulent Systems,JASA,2026,University of Notre Dame,Model Reduction and Neural Networks,0,46.735953,0.0,0.2695
JASA_2026_1323,Testing Independence and Conditional Independence in High Dimensions via Coordinatewise Gaussianization,JASA,2026,,Random Matrices and Applications,0,48.443922,0.0242,0.6162
JASA_2026_1324,High-dimensional Statistical Inference and Variable Selection Using Sufficient Dimension Association,JASA,2026,,Face and Expression Recognition,0,97.776896,0.0242,0.2357
JASA_2026_1325,Scalable Bayesian Image-on-Scalar Regression for Population-Scale Neuroimaging Data Analysis,JASA,2026,Open Data Institute | University of Chicago | University of Michigan | University of Oxford,Functional Brain Connectivity Studies,0,44.260227,0.0,0.1078
JASA_2026_1326,Correction,JASA,2026,,,0,,0.0,0.1962
JASA_2026_1327,Covariate-Adjusted Response-Adaptive Design with Delayed Outcomes,JASA,2026,,Statistical Methods in Clinical Trials,0,97.691064,0.0233,0.3084
JASA_2026_1328,Tests for principal eigenvalues and eigenvectors,JASA,2026,Hong Kong University of Science and Technology | Princeton University | Shanghai University of Finance and Economics | University of Hong Kong,Statistical Distribution Estimation and Applications,0,92.176591,0.5523,0.5502
JASA_2026_1330,Theory for Identification and Inference with Synthetic Controls: A Proximal Causal Inference Framework,JASA,2026,Carnegie Mellon University | King University | Peking University | St. Jude Children's Research Hospital | University of Michigan | University of Pennsylvania | Wharton County Junior College | William P. Wharton Trust,Advanced Causal Inference Techniques,0,49.251596,0.0239,0.1453
JASA_2026_1332,Facilitating heterogeneous effect estimation via statistically efficient categorical modifiers,JASA,2026,Cornell University,Face and Expression Recognition,0,48.995959,0.1199,0.2129
JASA_2026_1333,Stationarity of Manifold Time Series,JASA,2026,National University of Singapore | University of Toronto,Time Series Analysis and Forecasting,0,48.080065,0.0462,0.2369
JASA_2026_1334,Correction,JASA,2026,,,0,,0.0,0.1962
JASA_2026_1335,Staleness Factors and Volatility Estimation at High Frequencies,JASA,2026,University of Science and Technology of China,Financial Risk and Volatility Modeling,0,93.601583,0.1184,0.2832
JASA_2026_1336,A Burden Shared is a Burden Halved: A Fairness-Adjusted Approach to Classification,JASA,2026,Communication University of Zhejiang | Emory University | The University of Sydney | University of Hong Kong,Ethics and Social Impacts of AI,0,92.072783,0.0089,0.0582
JASA_2026_1338,Doubly robust pointwise confidence intervals for a monotonic continuous treatment effect curve,JASA,2026,University of Minnesota,Statistical Methods in Clinical Trials,0,57.25190799999999,0.3338,0.2496
JASA_2026_1341,Nonparametric Causal Inference for Optogenetics: Sequential Excursion Effects for Dynamic Regimes,JASA,2026,National Institute of Mental Health | University of Pennsylvania,Quantum Mechanics and Applications,0,61.856702,0.0879,0.2371
JASA_2026_1342,Hyperbolic Network Latent Space Model with Learnable Curvature,JASA,2026,,Graph Theory and Algorithms,0,97.827402,0.1992,0.2326
JASA_2026_1343,Inside-out cross-covariance for spatial multivariate data,JASA,2026,,Spatial and Panel Data Analysis,0,98.856306,0.1363,0.4116
JASA_2026_1344,Inference for Deep Neural Network Estimators in Generalized Nonparametric Models,JASA,2026,University of Michigan,Generative Adversarial Networks and Image Synthesis,0,54.674299000000005,0.0362,0.2609
JASA_2026_1346,Mini-batch Estimation for Deep Cox Models: Statistical Foundations and Practical Guidance,JASA,2026,Carnegie Mellon University | University of Pittsburgh,Statistical Methods and Bayesian Inference,0,94.971161,0.4831,0.4849
JASA_2026_1350,Adapting to Noise Tails in Private Linear Regression,JASA,2026,Academy of Mathematics and Systems Science | Chinese Academy of Sciences | College of Business Administration | Hong Kong University of Science and Technology | Illinois College | Peking University | Southwestern University of Finance and Economics | University of Illinois Chicago,Statistical Methods and Inference,0,61.655901,0.0774,0.5173
