paper_id,title,journal_short,publication_year,institution_names,primary_topic,cited_by_count,citation_percentile,exact_math_density,broad_math_density
JASA_2024_0807,Inferring Covariance Structure from Multiple Data Sources via Subspace Factor Analysis,JASA,2024,Duke University | The University of Texas at Dallas,Gene expression and cancer classification,5,77.68637000000001,0.3251,0.348
JASA_2024_0808,eDNAPlus: A Unifying Modeling Framework for DNA-based Biodiversity Monitoring,JASA,2024,Chinese Academy of Sciences | Kunming Institute of Zoology | Lancaster University | Oregon Department of Fish and Wildlife | Oregon State University | University College London | University of Chinese Academy of Sciences | University of East Anglia | University of Essex | University of Kent,Environmental DNA in Biodiversity Studies,5,87.811254,0.053,0.3295
JASA_2023_0811,Value Enhancement of Reinforcement Learning via Efficient and Robust Trust Region Optimization,JASA,2023,Decision Sciences (United States) | George Washington University | London School of Economics and Political Science | Shanghai University of Finance and Economics,Advanced Bandit Algorithms Research,4,78.089665,0.0191,0.3873
JASA_2023_0812,A General Framework for Circular Local Likelihood Regression,JASA,2023,KU Leuven | Statistics Belgium | Universidade de Santiago de Compostela,Bayesian Methods and Mixture Models,4,76.14681,0.2594,0.3537
JASA_2023_0813,Doubly Robust Interval Estimation for Optimal Policy Evaluation in Online Learning,JASA,2023,"North Carolina State University | University of California, Irvine",Advanced Bandit Algorithms Research,4,79.154985,0.0067,0.5948
JASA_2023_0814,Minimum Resource Threshold Policy Under Partial Interference,JASA,2023,University of Pennsylvania | University of Wisconsin–Madison,Advanced Wireless Network Optimization,4,65.31590299999999,0.0202,0.3447
JASA_2025_0815,Robust Bayesian Modeling of Counts with Zero Inflation and Outliers: Theoretical Robustness and Efficient Computation,JASA,2025,Keio University | Kyoto University | The University of Tokyo,Statistical Methods and Bayesian Inference,4,97.617938,0.1796,0.383
JASA_2023_0817,"Unified Unconditional Regression for Multivariate Quantiles, M-Quantiles, and Expectiles",JASA,2023,European University of Rome | Sapienza University of Rome | University of Pisa | University of Southampton,Advanced Statistical Methods and Models,3,77.669298,0.039,0.2454
JASA_2023_0818,Latent Multimodal Functional Graphical Model Estimation,JASA,2023,Stanford University | University of Chicago | University of Illinois Urbana-Champaign,Functional Brain Connectivity Studies,3,63.34339799999999,0.4359,0.5197
JASA_2023_0819,A Regression-Based Approach to Robust Estimation and Inference for Genetic Covariance,JASA,2023,Cancer Research And Biostatistics | Harvard University | Renmin University of China | University of Pennsylvania,Genetic and phenotypic traits in livestock,3,79.924519,0.0,0.2042
JASA_2024_0821,Efficient Nonparametric Estimation of Stochastic Policy Effects with Clustered Interference,JASA,2024,University of Michigan | University of North Carolina at Chapel Hill,Advanced Causal Inference Techniques,3,85.33517499999999,0.0395,0.5668
JASA_2024_0822,Doubly Robust Augmented Model Accuracy Transfer Inference with High Dimensional Features,JASA,2024,Bentley University | Columbia University | Harvard University | National University of Singapore,Domain Adaptation and Few-Shot Learning,3,78.889188,0.0771,0.3912
JASA_2024_0824,A Model-Agnostic Graph Neural Network for Integrating Local and Global Information,JASA,2024,"University of California, Irvine",Advanced Graph Neural Networks,3,80.320237,0.0,0.0908
JASA_2024_0825,On Optimality of Mallows Model Averaging,JASA,2024,Renmin University of China | Tsinghua University,Stochastic processes and financial applications,3,84.025913,0.1228,0.521
JASA_2024_0826,Euclidean Mirrors and Dynamics in Network Time Series,JASA,2024,Johns Hopkins Medicine | Johns Hopkins University | Johns Hopkins University Applied Physics Laboratory | University of Virginia,Complex Network Analysis Techniques,3,71.976053,0.0563,0.2085
JASA_2024_0827,Iterative Methods for Vecchia-Laplace Approximations for Latent Gaussian Process Models,JASA,2024,ETH Zurich | Lucerne University of Applied Sciences and Arts | University of Basel,Gaussian Processes and Bayesian Inference,3,80.691911,0.1431,0.3899
JASA_2024_0828,Additive Covariance Matrix Models: Modeling Regional Electricity Net-Demand in Great Britain,JASA,2024,Statistical and Applied Mathematical Sciences Institute | University of Bristol | University of Glasgow | University of Trieste | University of Udine,Electric Power System Optimization,3,67.89618899999999,0.0,0.1932
JASA_2024_0829,Spatio-Temporal Modeling for Record-Breaking Temperature Events in Spain,JASA,2024,Duke University | Universidad de Zaragoza,Meteorological Phenomena and Simulations,3,75.841002,0.0,0.1863
JASA_2024_0830,High-Dimensional Knockoffs Inference for Time Series Data,JASA,2024,"Academia Sinica | Institute of Statistical Science, Academia Sinica | National Tsing Hua University | University of Southern California",Time Series Analysis and Forecasting,3,76.642104,0.0655,0.4469
JASA_2025_0832,Partially Exchangeable Stochastic Block Models for (Node-Colored) Multilayer Networks,JASA,2025,"Bocconi University | University of Maryland, College Park",Complex Network Analysis Techniques,3,92.400052,0.0804,0.2417
JASA_2025_0833,Testing Elliptical Models in High Dimensions,JASA,2025,,Soil Geostatistics and Mapping,3,81.038414,0.0651,0.4443
JASA_2025_0834,Debiasing Watermarks for Large Language Models via Maximal Coupling,JASA,2025,Argonne National Laboratory | King University | Peking University | Quantitative BioSciences | University of Pennsylvania,Topic Modeling,3,95.962872,0.1211,0.1622
JASA_2025_0835,Bayesian Geostatistics Using Predictive Stacking,JASA,2025,"Columbia University | University of California, Los Angeles | University of Southern California",Soil Geostatistics and Mapping,3,82.578622,0.1309,0.309
JASA_2024_0836,Robust Permutation Tests in Linear Instrumental Variables Regression,JASA,2024,York University,International Development and Aid,2,87.654764,0.0357,0.2498
JASA_2023_0839,Smoothness-Penalized Deconvolution (SPeD) of a Density Estimate,JASA,2023,Cornell University,Statistical Methods and Inference,2,77.897798,0.0357,0.0325
JASA_2024_0841,Enhanced Response Envelope via Envelope Regularization,JASA,2024,University of Minnesota | University of Southern California,Sparse and Compressive Sensing Techniques,2,63.935624,0.0234,0.2883
JASA_2025_0842,Fast Signal Region Detection With Application to Whole Genome Association Studies,JASA,2025,Columbia University | King University | Peking University,Gene expression and cancer classification,2,78.80419400000001,0.0,0.1069
JASA_2025_0843,Random Effects Model-Based Sufficient Dimension Reduction for Independent Clustered Data,JASA,2025,Australian National University | The University of Sydney,Bayesian Methods and Mixture Models,2,93.196819,0.0255,0.3297
JASA_2025_0844,Data Fusion Using Weakly Aligned Sources,JASA,2025,Cape Town HVTN Immunology Laboratory / Hutchinson Centre Research Institute of South Africa | Fred Hutch Cancer Center | Harvard University | University of Washington,Statistical Methods and Inference,2,93.128253,0.258,0.4098
JASA_2025_0845,"Positive and Unlabeled Data: Model, Estimation, Inference, and Classification",JASA,2025,East China Normal University | Iowa State University | University of Waterloo,Machine Learning and Data Classification,2,93.285705,0.035,0.2231
JASA_2025_0846,Cutting Feedback in Misspecified Copula Models,JASA,2025,Monash University | National University of Singapore | The University of Melbourne,Financial Risk and Volatility Modeling,2,91.583815,0.1043,0.2144
JASA_2025_0848,Tail Calibration of Probabilistic Forecasts,JASA,2025,ETH Zurich | KU Leuven | University of Bern,Forecasting Techniques and Applications,2,92.505483,0.2125,0.2735
JASA_2025_0849,The ICML 2023 Ranking Experiment: Examining Author Self-Assessment in ML/AI Peer Review,JASA,2025,California University of Pennsylvania | Massachusetts Institute of Technology | New York University | Princeton University | University of North Carolina at Chapel Hill | University of Pennsylvania | University of Wisconsin–Madison,Topic Modeling,2,93.961678,0.0,0.0614
JASA_2025_0850,Conformal Prediction for Network-Assisted Regression,JASA,2025,University of Michigan | Washington University in St. Louis,Advanced Graph Neural Networks,2,94.048805,0.0646,0.2487
JASA_2025_0851,Communication-Efficient Distributed Estimation and Inference for Cox’s Model,JASA,2025,Princeton University,Distributed Sensor Networks and Detection Algorithms,2,90.702602,0.5003,0.5426
JASA_2025_0852,Estimation of Out-of-Sample Sharpe Ratio for High Dimensional Portfolio Optimization,JASA,2025,University of Hong Kong | University of Michigan,Financial Markets and Investment Strategies,2,93.264309,0.2074,0.3862
JASA_2025_0853,Efficient Distributed Learning over Decentralized Networks with Convoluted Support Vector Machine,JASA,2025,Renmin University of China | University of Michigan,Sparse and Compressive Sensing Techniques,2,87.62676499999999,0.0,0.2079
JASA_2026_0854,Network Regression and Supervised Centrality Estimation,JASA,2026,California University of Pennsylvania | Tsinghua University | University of Hong Kong | University of Notre Dame | Washington University in St. Louis,Game Theory and Applications,1,98.33465,0.3882,0.1636
JASA_2023_0855,Dynamic Matrix Recovery,JASA,2023,Academy of Mathematics and Systems Science | Chinese Academy of Sciences | King University | Peking University,Sparse and Compressive Sensing Techniques,1,50.03691500000001,0.0216,0.4671
JASA_2024_0857,Rational Kriging,JASA,2024,Georgia Institute of Technology,Probabilistic and Robust Engineering Design,1,67.919129,0.0083,0.2003
JASA_2024_0859,Statistical Inference for Networks of High-Dimensional Point Processes,JASA,2024,Seattle University | University of Chicago | University of Washington,Point processes and geometric inequalities,1,72.428135,0.5007,0.5373
JASA_2024_0860,Two Sample Test for Covariance Matrices in Ultra-High Dimension,JASA,2024,"University of California, Davis",Random Matrices and Applications,1,74.50796600000001,0.203,0.3016
JASA_2024_0861,Adaptive Testing for High-Dimensional Data,JASA,2024,Texas A&M University | Two Sigma Investments (United States) | University of Illinois Urbana-Champaign,Statistical Methods and Inference,1,75.65727799999999,0.0876,0.366
JASA_2025_0865,High-Dimensional Expected Shortfall Regression,JASA,2025,University of Illinois Chicago | University of Michigan | Washington University in St. Louis,Statistical Methods and Inference,1,83.41457199999999,0.0699,0.3164
JASA_2025_0866,Estimation of Over-Parameterized Models from an Auto-Modeling Perspective,JASA,2025,,Advanced Multi-Objective Optimization Algorithms,1,79.592931,0.0286,0.2383
JASA_2025_0867,Multi-Dimensional Domain Generalization with Low-Rank Structures,JASA,2025,Renmin University of China | Rutgers Sexual and Reproductive Health and Rights,Advanced Numerical Methods in Computational Mathematics,1,71.511826,0.0792,0.3194
JASA_2025_0869,Estimating Heterogeneous Causal Mediation Effects with Bayesian Decision Tree Ensembles,JASA,2025,The University of Texas at Austin,Advanced Causal Inference Techniques,1,85.76143499999999,0.0,0.1158
JASA_2025_0871,Integrated Path Stability Selection,JASA,2025,Harvard University,Fault Detection and Control Systems,1,79.319959,0.1386,0.2342
JASA_2025_0872,"Additive Multi-Index Gaussian Process Modeling, with Application to Multi-Physics Surrogate Modeling of the Quark-Gluon Plasma",JASA,2025,Duke University | Vanderbilt University,Gaussian Processes and Bayesian Inference,1,89.81922399999999,0.0068,0.1763
JASA_2025_0873,Debiased Calibration Estimation Using Generalized Entropy in Survey Sampling,JASA,2025,Iowa State University | King University | Korea Military Academy | Peking University,Survey Sampling and Estimation Techniques,1,89.017929,0.0548,0.287
JASA_2025_0875,A Bayesian Nonparametric Approach to Mediation and Spillover Effects with Multiple Mediators in Cluster-Randomized Trials,JASA,2025,Yale University,Advanced Causal Inference Techniques,1,89.390921,0.1662,0.3668
JASA_2025_0878,Policy Learning with Distributional Welfare,JASA,2025,Communication University of Zhejiang | University of Bristol | Zhejiang University,Advanced Causal Inference Techniques,1,89.39067200000001,0.1063,0.2843
JASA_2025_0879,Spatiotemporal Besov Priors for Bayesian Inverse Problems,JASA,2025,"Arizona State University | Irvine University | University of California, Irvine | Virginia Tech",Numerical methods in inverse problems,1,92.334152,0.1614,0.2808
JASA_2025_0881,High-Dimensional Spatial Autoregression with Latent Factors by Diversified Projections,JASA,2025,Fudan University | Peking University | Renmin University of China,Spatial and Panel Data Analysis,1,93.005892,0.0355,0.2575
JASA_2025_0882,Consistent Least Squares Estimation in Population-Size-Dependent Branching Processes,JASA,2025,The University of Melbourne | UNSW Sydney | Universidad de Extremadura,Stochastic processes and statistical mechanics,1,92.748333,0.0,0.4267
JASA_2025_0883,Conjugate Gradient Methods for High-Dimensional GLMMs,JASA,2025,Bocconi University | Decision Sciences (United States),Advanced Numerical Methods in Computational Mathematics,1,81.030108,0.2052,0.2016
JASA_2025_0884,Linear-Cost Vecchia Approximation of Multivariate Normal Probabilities,JASA,2025,University of Houston | University of Wisconsin–Madison,Soil Geostatistics and Mapping,1,82.920175,0.0547,0.1573
JASA_2026_0887,Balancing Weights for Causal Inference in Observational Factorial Studies,JASA,2026,"University of California, Berkeley | University of Illinois Urbana-Champaign",Advanced Causal Inference Techniques,1,98.261891,0.2744,0.4209
JASA_2026_0888,"Contextual Dynamic Pricing: Algorithms, Optimality, and Local Differential Privacy Constraints",JASA,2026,Fudan University | University of Notre Dame | University of Warwick,Privacy-Preserving Technologies in Data,1,98.658961,0.3538,0.2892
JASA_2026_0889,Adaptive Partition Factor Analysis,JASA,2026,Barcelona School of Economics | Universitat Pompeu Fabra,Psychometric Methodologies and Testing,1,99.19427,0.1105,0.1163
JASA_2026_0890,Toward Interpretable Deep Generative Models via Causal Representation Learning,JASA,2026,Rutgers Sexual and Reproductive Health and Rights | University of Chicago,Explainable Artificial Intelligence (XAI),1,99.052899,0.0,0.0821
JASA_2026_0891,Scalable community detection in massive networks via predictive assignment,JASA,2026,North Carolina State University | Pennsylvania State University | University of Central Florida,Complex Network Analysis Techniques,1,98.941135,0.0279,0.4487
JASA_2026_0892,Multi-Scale CUSUM Tests for Time Dependent Spherical Random Fields,JASA,2026,Libera Università Internazionale degli Studi Sociali Guido Carli | Sapienza University of Rome | University of Rome Tor Vergata,Theoretical and Computational Physics,1,99.060052,0.0766,0.3987
JASA_2023_0893,Bayesian Conditional Transformation Models,JASA,2023,Quantified Uncertainty Research Institute | TU Dortmund University | University of Göttingen,Statistical Methods and Inference,8,86.134192,0.0163,0.1677
JASA_2023_0897,A Feasibility Study of Differentially Private Summary Statistics and Regression Analyses with Evaluations on Administrative and Survey Data,JASA,2023,Florida State University | RAND Corporation | Urban Institute,Privacy-Preserving Technologies in Data,6,81.496768,0.0,0.0427
JASA_2023_0899,A Wasserstein Index of Dependence for Random Measures,JASA,2023,Bocconi University | Libera Università Internazionale degli Studi Sociali Guido Carli,Bayesian Methods and Mixture Models,5,77.286569,0.3488,0.3153
JASA_2023_0900,Multivariate Sparse Clustering for Extremes,JASA,2023,"Centre National de la Recherche Scientifique | Institut national de recherche en sciences et technologies du numérique | Laboratoire de Probabilités, Statistique et Modélisation | Sorbonne Université | University of Vienna | Université de Montpellier | Wolfgang Pauli Institute",Financial Risk and Volatility Modeling,5,80.827196,0.0809,0.4368
JASA_2023_0901,Inference in High-Dimensional Online Changepoint Detection,JASA,2023,London School of Economics and Political Science | University of Cambridge,Statistical Methods and Inference,5,83.87314099999999,0.3352,0.4252
JASA_2023_0903,Test of Significance for High-Dimensional Thresholds with Application to Individualized Minimal Clinically Important Difference,JASA,2023,Cornell University | University of Wisconsin–Madison,Statistical Methods and Inference,4,80.193979,0.3615,0.5406
JASA_2023_0904,"In Nonparametric and High-Dimensional Models, Bayesian Ignorability is an Informative Prior",JASA,2023,The University of Texas at Austin,Statistical Methods and Inference,4,75.169599,0.0625,0.2346
JASA_2024_0905,Doubly-Valid/Doubly-Sharp Sensitivity Analysis for Causal Inference with Unmeasured Confounding,JASA,2024,Cornell University | Princeton University | Stanford University,Advanced Causal Inference Techniques,4,89.212253,0.4749,0.4449
JASA_2024_0906,Generalized Bayesian Additive Regression Trees Models: Beyond Conditional Conjugacy,JASA,2024,The University of Texas at Austin,Bayesian Methods and Mixture Models,4,83.588752,0.0255,0.2446
JASA_2024_0907,Optimal Network Membership Estimation under Severe Degree Heterogeneity,JASA,2024,Harvard University | University of Virginia,Complex Network Analysis Techniques,4,75.760323,0.0958,0.4657
JASA_2023_0910,Bayesian Spline-Based Hidden Markov Models with Applications to Actimetry Data and Sleep Analysis,JASA,2023,MRC Biostatistics Unit | University of Cambridge | University of Warwick,Bayesian Methods and Mixture Models,3,72.471377,0.0,0.1518
JASA_2024_0912,Monte Carlo Inference for Semiparametric Bayesian Regression,JASA,2024,Columbia University | Cornell University | Rice University,Statistical Methods and Inference,3,86.962956,0.0631,0.189
JASA_2024_0914,When Frictions Are Fractional: Rough Noise in High-Frequency Data,JASA,2024,Columbia University | Helmholtz Zentrum München | Hong Kong University of Science and Technology,Financial Risk and Volatility Modeling,3,85.049082,0.424,0.4432
JASA_2024_0915,Sensitivity Analysis for Quantiles of Hidden Biases in Matched Observational Studies,JASA,2024,University of Chicago | University of Illinois Urbana-Champaign,Advanced Causal Inference Techniques,3,88.530661,0.3375,0.3575
JASA_2025_0916,Robust Inference for Federated Meta-Learning,JASA,2025,"Harvard University | Health Sciences North | Rutgers Sexual and Reproductive Health and Rights | University of California, Berkeley",Statistical Methods and Inference,3,95.935235,0.0,0.4089
JASA_2025_0917,Inference in Generalized Linear Models with Robustness to Misspecified Variances,JASA,2025,Erasmus University Rotterdam | Leiden University Medical Center | University of California San Diego | University of Padua,Statistical Methods and Inference,3,96.566161,0.2089,0.1829
JASA_2025_0918,Nonparametric Test for Rough Volatility,JASA,2025,Hong Kong University of Science and Technology,Financial Risk and Volatility Modeling,3,95.737033,0.5796,0.5348
JASA_2023_0920,Bayesian Robustness: A Nonasymptotic Viewpoint,JASA,2023,"Haliç University | Stanford University | University of California System | University of California, Berkeley | University of California, San Diego",Markov Chains and Monte Carlo Methods,5,67.85544,0.2388,0.3464
JASA_2023_0922,Bootstrap Prediction Bands for Functional Time Series,JASA,2023,,Statistical Methods and Inference,4,67.871337,0.0117,0.4009
JASA_2023_0923,Network Estimation by Mixing: Adaptivity and More,JASA,2023,"University of California, Davis | University of Minnesota",Complex Network Analysis Techniques,4,63.162264,0.1717,0.2122
JASA_2023_0924,Overcoming Repeated Testing Schedule Bias in Estimates of Disease Prevalence,JASA,2023,The Ohio State University | University of Dayton,SARS-CoV-2 detection and testing,4,70.354861,0.134,0.2253
JASA_2023_0925,Copula Modeling of Serially Correlated Multivariate Data with Hidden Structures,JASA,2023,Statistical Research (United States) | University of Toronto,Bayesian Methods and Mixture Models,4,76.006355,0.2865,0.3906
JASA_2023_0926,Higher-Order Expansions and Inference for Panel Data Models,JASA,2023,Australian Regenerative Medicine Institute | Monash University | Shanghai University of Finance and Economics,Spatial and Panel Data Analysis,4,90.974213,0.0467,0.3646
JASA_2024_0927,Model-Free Statistical Inference on High-Dimensional Data,JASA,2024,Beijing Normal University | Nankai University | Pennsylvania State University,Statistical Methods and Inference,4,88.63512999999999,0.0452,0.4192
JASA_2024_0928,Efficient Stochastic Generators with Spherical Harmonic Transformation for High-Resolution Global Climate Simulations from CESM2-LENS2,JASA,2024,King Abdullah University of Science and Technology | Lahore University of Management Sciences,Meteorological Phenomena and Simulations,4,77.77640099999999,0.0,0.2199
JASA_2024_0929,"A Physics-Informed, Deep Double Reservoir Network for Forecasting Boundary Layer Velocity",JASA,2024,University of Notre Dame,Reservoir Engineering and Simulation Methods,4,79.276939,0.0,0.0928
JASA_2023_0931,Bayesian Landmark-Based Shape Analysis of Tumor Pathology Images,JASA,2023,Southern Methodist University | The University of Texas Southwestern Medical Center | The University of Texas at Dallas,AI in cancer detection,3,69.098517,0.0,0.1331
JASA_2023_0932,Handbook of Bayesian Variable Selection,JASA,2023,Texas A&M University,Statistical Methods and Inference,3,75.94516,0.0,0.2129
JASA_2023_0934,"Testing Directed Acyclic Graph via Structural, Supervised and Generative Adversarial Learning",JASA,2023,"London School of Economics and Political Science | University of California, Berkeley",Advanced Graph Neural Networks,3,70.007076,0.0173,0.3411
JASA_2023_0935,DDAC-SpAM: A Distributed Algorithm for Fitting High-dimensional Sparse Additive Models with Feature Division and Decorrelation,JASA,2023,Chinese University of Hong Kong | East China Normal University | New York University,Statistical Methods and Inference,3,76.609888,0.0542,0.4608
JASA_2023_0936,Covariate-Assisted Bayesian Graph Learning for Heterogeneous Data,JASA,2023,Texas A&M University | University of Houston,Gene expression and cancer classification,3,66.513145,0.2317,0.3542
JASA_2024_0940,Evaluating Dynamic Conditional Quantile Treatment Effects with Applications in Ridesharing,JASA,2024,Didi Chuxing (China) | London School of Economics and Political Science | Shanghai University of Finance and Economics | University of North Carolina at Chapel Hill,Transportation and Mobility Innovations,3,62.279147,0.2727,0.3358
JASA_2024_0942,Testing a Large Number of Composite Null Hypotheses Using Conditionally Symmetric Multidimensional Gaussian Mixtures in Genome-Wide Studies,JASA,2024,Harvard University | Instituto Superior Politécnico Metropolitano de Angola | The University of Texas MD Anderson Cancer Center,Genetic Associations and Epidemiology,3,88.245348,0.027,0.1645
JASA_2024_0944,Coexchangeable Process Modeling for Uncertainty Quantification in Joint Climate Reconstruction,JASA,2024,British Library | The Alan Turing Institute | The University of Western Australia | Turing Institute | University of Exeter | University of Leeds,Atmospheric and Environmental Gas Dynamics,2,61.475834,0.0069,0.2299
JASA_2023_0945,Bayesian Inference Using the Proximal Mapping: Uncertainty Quantification Under Varying Dimensionality,JASA,2023,"Duke University | University of California, Los Angeles | University of Florida",Statistical Methods and Inference,2,70.156307,0.072,0.2965
JASA_2025_0947,Inference on the Proportion of Variance Explained in Principal Component Analysis,JASA,2025,University of Michigan | University of Southern California | University of Washington,Gene expression and cancer classification,2,78.324624,0.302,0.3293
JASA_2024_0948,Statistical Inference For Noisy Matrix Completion Incorporating Auxiliary Information,JASA,2024,"Brandeis University | Singapore Management University | University of California, Riverside",Sparse and Compressive Sensing Techniques,2,62.322746,0.5547,0.5811
JASA_2024_0950,Natural Gradient Variational Bayes Without Fisher Matrix Analytic Calculation and Its Inversion,JASA,2024,"Laboratoire de Probabilités et Modèles Aléatoires | Laboratoire de Probabilités, Statistique et Modélisation | Marist College | Marist School | Sorbonne Université | The University of Sydney",Blind Source Separation Techniques,2,68.403255,0.305,0.4552
JASA_2024_0952,Large-Scale Low-Rank Gaussian Process Prediction with Support Points,JASA,2024,King Abdullah University of Science and Technology | Renmin University of China,Gaussian Processes and Bayesian Inference,2,75.588917,0.0,0.1917
JASA_2024_0953,Model-Based Clustering of Categorical Data Based on the Hamming Distance,JASA,2024,University of Bergamo | Università Cattolica del Sacro Cuore | Università della Svizzera italiana,Bayesian Methods and Mixture Models,2,75.16248399999999,0.0232,0.168
JASA_2024_0954,Quantification of Vaccine Waning as a Challenge Effect,JASA,2024,"Czech Academy of Sciences, Institute of Mathematics | Institute of Mathematics and Informatics | University of Oslo | École Polytechnique Fédérale de Lausanne",SARS-CoV-2 and COVID-19 Research,2,72.008091,0.0946,0.297
JASA_2024_0957,Bayesian Clustering via Fusing of Localized Densities,JASA,2024,Duke University,Bayesian Methods and Mixture Models,2,76.367176,0.1987,0.3396
